id,citation_key,decision,reason,title,year,author,journal
1297,Bharti2022,INCLUDE,Meets PICOS criteria,Stock Market Price Prediction through News Sentiment Analysis & Ensemble Learning,2022,"Bharti, Santosh Kumar and Tratiya, Priyansh and Gu...",
1298,Mishal2022657,INCLUDE,Meets PICOS criteria,Prediction of Cryptocurrency Price using Machine Learning Techniques and Public Sentiment Analysis,2022,"Mishal, Mehedi Hasan and Jannat Rakhi, Nura and Ra...",
1299,Cui2022160,INCLUDE,Meets PICOS criteria,Novel Sentiment Analysis from Twitter for Stock Change Prediction,2022,"Cui, Yang and Jiang, Yucen and Gu, Haisong",Communications in Computer and Information Science
1300,Etheridge202256,INCLUDE,Meets PICOS criteria,Distilling Business Value from COVID - 19 Public Media Dataset with Machine Learning and Natural Language Processing,2022,"Etheridge, Tracey and Lu, Guang and Lipenkova, Jan...",
1302,Metawa202259,INCLUDE,Meets PICOS criteria,Multi-objective Decision Making Model for Stock Price Prediction Using Multi-source Heterogeneous Data Fusion,2022,"Metawa, Noura and Metawea, Maha",Fusion: Practice and Applications
1303,Zheng20223567,INCLUDE,Meets PICOS criteria,SFPAD: Sentiment-driven Firm Pricing Anomaly Detection Algorithm and Application,2022,"Zheng, Senyuan and Lee, Vincent C.S. and Guan, Zha...",
1305,Rekha2022,INCLUDE,Meets PICOS criteria,A cooperative deep learning model for stock market prediction using deep autoencoder and sentiment analysis,2022,"Rekha, K. Sashi and Sabu, M. K.",PeerJ Computer Science
1308,Lele2022,INCLUDE,Meets PICOS criteria,Sentiment Analysis of the Indian Financial Market,2022,"Lele, Ria and Diyora, Aarsh and Cooper, Sheroy and...",
1310,Abdou202241,INCLUDE,Meets PICOS criteria,Gold Price Prediction using Sentiment Analysis,2022,"Abdou, Mariem and Shaltout, Menna and Godah, Alaa ...",
1312,Hasan2022,INCLUDE,Meets PICOS criteria,Sentiment Analysis on Cryptocurrency Based on Tweets and Retweets Using Support Vector Machines and Chi-Square,2022,"Hasan, Isabella Donita and Oetama, Raymond Sunardi...",
1313,Bajpai2022412,INCLUDE,Meets PICOS criteria,An Efficient Method to Predict the Tata- Motors Stock Price using Hybrid Machine Learning Methods,2022,"Bajpai, Abhishek and Singh, Anjali and Verma, Abhi...",
1314,Chong202290,INCLUDE,Meets PICOS criteria,Comparison of Naive Bayes and SVM Classification in Grid-Search Hyperparameter Tuned and Non-Hyperparameter Tuned Healthcare Stock Market Sentiment Analysis,2022,"Chong, Kai Siang and Shah, Nathar",International Journal of Advanced Computer Science and Applications
1318,Fernandez2022240,INCLUDE,Meets PICOS criteria,Improving IndoBERT for Sentiment Analysis on Indonesian Stock Trader Slang Language,2022,"Fernandez, Enrico and Anderies, Anderies and Winat...",
1319,Mohamad Zamani202236,INCLUDE,Meets PICOS criteria,XLNET-GRU Sentiment Regression Model for Cryptocurrency News in English and Malay,2022,"Mohamad Zamani, Nur Azmina and Yan, Jasy Liew Suet...",
1321,Faria2022578,INCLUDE,Meets PICOS criteria,Tweet and News Sentiment Indicators and the Behavior of the Brazilian Stock Market,2022,"Faria, Lucas J. and Silva, Kéthlyn Campos and Fern...",IEEE International Conference on Industrial Informatics (INDIN)
1323,Gehlot2022,INCLUDE,Meets PICOS criteria,Estimation of Sentiment Analysis Base Stock Market Crisis,2022,"Gehlot, Aastha and Singh, Rajesh",
1324,Iordache20225130,INCLUDE,Meets PICOS criteria,Investigating the Relationship Between Romanian Financial News and Closing Prices from the Bucharest Stock Exchange,2022,"Iordache, Ioan Bogdan and Uban, Ana Sabina and Sto...",
1325,Wojarnik20222059,INCLUDE,Meets PICOS criteria,Sentiment analysis towards listed companies in the energy sector on the example of the WIG-Energia index on the WSE,2022,"Wojarnik, Grzegorz",Procedia Computer Science
1326,Son20221301,INCLUDE,Meets PICOS criteria,Using Transformers and Deep Learning with Stance Detection to Forecast Cryptocurrency Price Movement,2022,"Son, Yeonwoo and Vohra, Soham and Vakkalagadda, Ro...",International Conference on ICT Convergence
1327,Sharma2022791,INCLUDE,Meets PICOS criteria,Decision Support Machine- A Hybrid Model for Sentiment Analysis of News Headlines of Stock Market,2022,"Sharma, Kirti and Bhalla, Rajni",International Journal of Electrical and Computer Engineering Systems
1328,Rao202282,INCLUDE,Meets PICOS criteria,A Sentiment Analysis Based Stock Recommendation System,2022,"Rao, Jayanth and Ramaraju, Venkat and Smith, James...",
1329,Ekaputri2022,INCLUDE,Meets PICOS criteria,Financial News Sentiment Analysis using Modified VADER for Stock Price Prediction,2022,"Ekaputri, Anindya Prameswari and Akbar, Saiful",
1330,Salimath2022,INCLUDE,Meets PICOS criteria,Indian Stock Movement Prediction with Global Indices and Twitter Sentiment using Machine Learning,2022,"Salimath, Shwetha and Chatterjee, Triparna and Mat...",
1331,Bhadamkar202252,INCLUDE,Meets PICOS criteria,Tesla Inc. Stock Prediction using Sentiment Analysis,2022,"Bhadamkar, Amey and Bhattacharya, Sonali","Australasian Accounting, Business and Finance Journal"
1332,Alghamdi2022891,INCLUDE,Meets PICOS criteria,Cryptocurrency Price Prediction using Forecasting and Sentiment Analysis,2022,"Alghamdi, Shaimaa and Alqethami, Sara and Alsubait...",International Journal of Advanced Computer Science and Applications
1333,Nair2022,INCLUDE,Meets PICOS criteria,Bitcoin Price Prediction Using Sentimental Analysis - A Comparative Study of Neural Network Model for Price Prediction,2022,"Nair, Karthik and Pawle, Arham and Trisal, Aryan a...",
1337,Lakatos2022177,INCLUDE,Meets PICOS criteria,Predicting the direction of the oil price trend using sentiment analysis,2022,"Lakatos, Róbert and Bogacsovics, Gergő and Hajdu, ...",
1338,Jiménez-Zarco2022,INCLUDE,Meets PICOS criteria,DeeBERT-S3WD: Three-Way Multigranularity Decision for Interactive Information Sentiment Analysis Research,2022,"Jiménez-Zarco, Ana and Zhang, Xiangnan and Yu, Gua...",Mathematical Problems in Engineering
1339,Sariyer2022,INCLUDE,Meets PICOS criteria,Individual Stock Price Prediction by Using KAP and Twitter Sentiments with Machine Learning for BIST30,2022,"Sariyer, Muhlis and Akil, Ahmet and Bulgurcu, Feyz...",
1340,Foo2022530,INCLUDE,Meets PICOS criteria,Stock Movement Prediction with Social Sentiments and Interactional Data: Integrating NLP and Bayesian Frameworks,2022,"Foo, Marcus Jun Rong and Pun, Chi Seng",
1342,Saraswathi2022,INCLUDE,Meets PICOS criteria,Intelligent Stock Trading using LSTM Approach,2022,"Saraswathi, Pedada and Rao, Patruni Muralidhara an...",
1343,Kabbani202293564,INCLUDE,Meets PICOS criteria,Deep Reinforcement Learning Approach for Trading Automation in the Stock Market,2022,"Kabbani, Taylan and Duman, Ekrem",IEEE Access
1344,Lakshya2022,INCLUDE,Meets PICOS criteria,Stock Price Prediction Using News Sentiment Analysis,2022,"Lakshya, null and Prateek, null and Sethia, Divyas...",
1347,Harnmetta2022,INCLUDE,Meets PICOS criteria,Sentiment Analysis of Thai Stock Reviews Using Transformer Models,2022,"Harnmetta, Pongsatorn and Samanchuen, Taweesak",
1348,Atha2022413,INCLUDE,Meets PICOS criteria,Do Deep Learning Models and News Headlines Outperform Conventional Prediction Techniques on Forex Data?,2022,"Atha, Sucharita and Bolla, Bharath Kumar",Lecture Notes in Networks and Systems
1350,Shamisavi20221,INCLUDE,Meets PICOS criteria,"Forecasting Tehran Stock Exchange Trend with Time Series Analysis, Fundamental Data, and Sentiment Analysis in News",2022,"Shamisavi, Mahdi and Jahanshahi, Amir",
1351,Sonkiya2022,INCLUDE,Meets PICOS criteria,Stock Price Prediction Using Artificial Intelligence: A Survey,2022,"Sonkiya, Priyank and Bajpai, Vikas and Bansal, Anu...",
1352,Mousa20222279,INCLUDE,Meets PICOS criteria,Financial Market Sentiment Prediction Technology and Application Based on Machine Learning Model,2022,"Mousa, Saeed and Ramkumar, Gowtham and Mohamma, Ar...",
1354,Shao2022,INCLUDE,Meets PICOS criteria,Deep-Learning-Based Financial Message Sentiment Classification in Business Management,2022,"Shao, Chen and Chen, Xiaochen",Computational Intelligence and Neuroscience
1355,Karaşahin202236,INCLUDE,Meets PICOS criteria,Effectiveness of Social Media in Stock Market Price Prediction Based on Machine Learning,2022,"Karaşahin, Emre and Utku, Semih and Ozturkmenoglu,...",Lecture Notes in Networks and Systems
1357,Ahmed2022,INCLUDE,Meets PICOS criteria,Analysis and Prediction of Healthcare Sector Stock Price Using Machine Learning Techniques: Healthcare Stock Analysis,2022,"Ahmed, Daiyaan and Neema, Ronhit and Viswanadha, N...",International Journal of Information System Modeling and Design
1359,Gupta2022,INCLUDE,Meets PICOS criteria,Food Review Analysis and Sentiment Prediction using Machine Learning Models,2022,"Gupta, Dhruv and Roup, Ausho and Gupta, Diksha and...",
1360,Tak2022,INCLUDE,Meets PICOS criteria,Foreign Currency Exchange Market Prediction using Machine Learning Techniques,2022,"Tak, Adriel Li Chi and Logeswaran, Rajasvaran",
1362,El-Zini2022338,INCLUDE,Meets PICOS criteria,On the Evaluation of the Plausibility and Faithfulness of Sentiment Analysis Explanations,2022,"El-Zini, Julia and Mansour, Mohamad and Mousi, Bas...",IFIP Advances in Information and Communication Technology
1363,Lakshmanarao2022520,INCLUDE,Meets PICOS criteria,Twitter Sentiment Classification with Deep Learning LSTM for Airline Tweets,2022,"Lakshmanarao, A. and Srisaila, A. and Ravi Kiran, ...",
1364,Sachar2022199,INCLUDE,Meets PICOS criteria,Comparative Sentiment Analysis on Stock Market News Using Machine Learning,2022,"Sachar, Devansh and Goyal, Hemlata and Sharma, Vij...",Lecture Notes in Electrical Engineering
1365,Nabil2022421,INCLUDE,Meets PICOS criteria,A New Model for Stock Market Predication Using a Three-Layer Long Short-Term Memory,2022,"Nabil, Ayman M. and Magdi, Nebal",
1366,Altuner20221506,INCLUDE,Meets PICOS criteria,A novel deep reinforcement learning based stock price prediction using knowledge graph and community aware sentiments,2022,"Altuner, Anıl Berk and Kilimci, Zeynep Hi̇Lal",Turkish Journal of Electrical Engineering and Computer Sciences
1367,Chen2022105,INCLUDE,Meets PICOS criteria,Trend Prediction Of Stock Industry Index Based On Financial Text,2022,"Chen, Lihang and Kong, Ying and Lin, Jianwu",Procedia Computer Science
1368,Prasad2022,INCLUDE,Meets PICOS criteria,User Classification and Stock Market-Based Recommendation Engine Based on Machine Learning and Twitter Analysis,2022,"Prasad, N. Achyutha and Chaudhury, Sushovan and Bo...",Mathematical Problems in Engineering
1369,Divesh2022730,INCLUDE,Meets PICOS criteria,Sentiment Analysis on Cryptocurrency using Youtube Comments,2022,"Divesh, null and Prasad, Gaurav and Sharma, Gaurav...",
1371,Machavarapu202275,INCLUDE,Meets PICOS criteria,Reddit Sentiments Effects on Stock Market Prices,2022,"Machavarapu, Arnav","Smart Innovation, Systems and Technologies"
1372,Aslam202239313,INCLUDE,Meets PICOS criteria,Sentiment Analysis and Emotion Detection on Cryptocurrency Related Tweets Using Ensemble LSTM-GRU Model,2022,"Aslam, Naila and Rustam, F. and Lee, Ernesto and W...",IEEE Access
1373,Korivi2022623,INCLUDE,Meets PICOS criteria,A Novel Stock Price Prediction Scheme from Twitter Data by using Weighted Sentiment Analysis,2022,"Korivi, Nikhila and Naveen, Katla Sai and Keerthi,...",
1375,Alzazah2022103,INCLUDE,Meets PICOS criteria,Predict Market Movements Based on the Sentiment of Financial Video News Sites,2022,"Alzazah, Faten and Cheng, Xiaochun and Gao, Xiaoho...",
1376,Parekh202235398,INCLUDE,Meets PICOS criteria,DL-GuesS: Deep Learning and Sentiment Analysis-Based Cryptocurrency Price Prediction,2022,"Parekh, Raj and Patel, Nisarg P. and Thakkar, Niha...",IEEE Access
1377,Shaikh20221632,INCLUDE,Meets PICOS criteria,Stock Price Prediction with Sentimental Analysis,2022,"Shaikh, Bushra Almin and Iyer, Abhishekh and Konet...",
1378,Sawale2022,INCLUDE,Meets PICOS criteria,Stock Market Prediction using Sentiment Analysis and Machine Learning Approach,2022,"Sawale, Gaurav J. and Rawat, Manoj Kumar",
1379,Ye2022411,INCLUDE,Meets PICOS criteria,A Cryptocurrency Price Prediction Model Based on Twitter Sentiment Indicators,2022,"Ye, Zi and Liu, Weichen and Qu, Qiang and Jiang, Q...",Communications in Computer and Information Science
1380,Correia2022205,INCLUDE,Meets PICOS criteria,Deep Learning for Big Data,2022,"Correia, Filipe Figueiredo and Madureira, Ana Mari...",Lecture Notes in Networks and Systems
1381,Narla2022193,INCLUDE,Meets PICOS criteria,Predicting Stock Market Prices Using Sentiment Analysis of News Articles,2022,"Narla, Jayanth and Malreddy, Sai Venkat Reddy and ...",Communications in Computer and Information Science
1382,Singamaneni20221217,INCLUDE,Meets PICOS criteria,Stock Price Prediction Using Optimal Network Based Twitter Sentiment Analysis,2022,"Singamaneni, Kranthi Kumar and Akeji, Alhassan Alo...",Intelligent Automation and Soft Computing
1383,Netisopakul202249,INCLUDE,Meets PICOS criteria,Thai stock news classification based on price changes and sentiments,2022,"Netisopakul, Ponrudee and Saewong, Woranun",International Journal of Electronic Finance
1384,Darji202275,INCLUDE,Meets PICOS criteria,Comparative Study to Perform Tweets/NEWS Classification Using Big Data Analytics for Predicting Stock Market Price Movement,2022,"Darji, Miss Dhara N. and Parikh, Satyen M. and Pat...",Lecture Notes in Networks and Systems
1385,Mndawe2022,INCLUDE,Meets PICOS criteria,Development of a Stock Price Prediction Framework for Intelligent Media and Technical Analysis,2022,"Mndawe, Sibusiso T. and Paul, Babu Sena and Doorsa...",Applied Sciences (Switzerland)
1386,Daradkeh2022,INCLUDE,Meets PICOS criteria,A Hybrid Data Analytics Framework with Sentiment Convergence and Multi-Feature Fusion for Stock Trend Prediction,2022,"Daradkeh, Mohammad Kamel",Electronics (Switzerland)
1388,Patil2022423,INCLUDE,Meets PICOS criteria,Financial Forecasting of Stock Market Using Sentiment Analysis and Data Analytics,2022,"Patil, Dipashree and Patil, Shivani and Patil, Shr...",Lecture Notes in Networks and Systems
1391,Wang2022,INCLUDE,Meets PICOS criteria,The merits of a sentiment analysis of antecedent comments for the prediction of online fundraising outcomes,2022,"Wang, Wei and Guo, Lihuan and Wu, Yenchun Jim",Technological Forecasting and Social Change
1392,Sivri2022446,INCLUDE,Meets PICOS criteria,Ensemble Learning Based Stock Market Prediction Enhanced with Sentiment Analysis,2022,"Sivri, Mahmut Sami and Ustundag, Alp and Korkmaz, ...",Lecture Notes in Networks and Systems
1393,Alkan2022490,INCLUDE,Meets PICOS criteria,Currency Exchange Rate Forecasting with Social Media Sentiment Analysis,2022,"Alkan, Akıner and Alkaya, Ali Fuat and Schüller, P...",Lecture Notes in Networks and Systems
1394,Sivri2022155,INCLUDE,Meets PICOS criteria,From Statistical to Deep Learning Models: A Comparative Sentiment Analysis Over Commodity News,2022,"Sivri, Mahmut Sami and Korkmaz, Buse Sibel and Ust...",Lecture Notes in Networks and Systems
1396,Jain2022195,INCLUDE,Meets PICOS criteria,Stock Direction Prediction Using Sentiment Analysis of News Articles,2022,"Jain, Nipun and Motiani, Mohit and Kaur, Preeti",Lecture Notes in Networks and Systems
1397,Biswas2022,INCLUDE,Meets PICOS criteria,A text-mining based cyber-risk assessment and mitigation framework for critical analysis of online hacker forums,2022,"Biswas, Baidyanath N. and Mukhopadhyay, Arunabha a...",Decision Support Systems
1398,Palmer20228,INCLUDE,Meets PICOS criteria,Induction of a sentiment dictionary for financial analyst communication: a data-driven approach balancing machine learning and human intuition,2022,"Palmer, Matthias and Roeder, Jan and Muntermann, J...",Journal of Business Analytics
1399,Bilianos2022374,INCLUDE,Meets PICOS criteria,Experiments in Text Classification: Analyzing the Sentiment of Electronic Product Reviews in Greek,2022,"Bilianos, Dimitris",Journal of Quantitative Linguistics
1401,Pellon Consunji2021,INCLUDE,Meets PICOS criteria,EvoTrader: Automated bitcoin trading using neuroevolutionary algorithms on technical analysis and social sentiment data,2021,"Pellon Consunji, Martin",ACM International Conference Proceeding Series
1402,Wujec2021,INCLUDE,Meets PICOS criteria,Analysis of the Financial Information Contained in the Texts of Current Reports: A Deep Learning Approach,2021,"Wujec, Maciej",Journal of Risk and Financial Management
1405,Ho2021,INCLUDE,Meets PICOS criteria,Stock price movement prediction using sentiment analysis and candlestick chart representation,2021,"Ho, Trang Thi and Huang, Yennun",Sensors
1407,Paiva2021,INCLUDE,Meets PICOS criteria,Intelligent Trading Systems: A Sentiment-Aware Reinforcement Learning Approach,2021,"Paiva, Francisco Caio Lima and Felizardo, Leonardo...",
1408,Chen2021,INCLUDE,Meets PICOS criteria,Sentiment-influenced trading system based on multimodal deep reinforcement learning,2021,"Chen, Yufu and Huang, Szuhao",Applied Soft Computing
1411,Leow2021,INCLUDE,Meets PICOS criteria,Robo-advisor using genetic algorithm and BERT sentiments from tweets for hybrid portfolio optimisation,2021,"Leow, Edmund Kwong Wei and Nguyen, Binh P. and Chu...",Expert Systems with Applications
1412,Jing2021,INCLUDE,Meets PICOS criteria,A hybrid model integrating deep learning with investor sentiment analysis for stock price prediction,2021,"Jing, Nan and Wu, Zhao and Wang, Hefei",Expert Systems with Applications
1413,Furqon2021138,INCLUDE,Meets PICOS criteria,Predict Buy and Sell Time for Stock Price Using Convolutional Neural Network and Long Short-Term Memory,2021,"Furqon, Elvin Nur and Dirgantoro, Burhanuddin and ...",
1415,Akshara20211220,INCLUDE,Meets PICOS criteria,An Effective Model to Prognosticate the Stock Market Tendency Using Social Media,2021,"Akshara, Revelle and Reddy, S. Saikumar and Reddy,...",
1416,Azizi2021799,INCLUDE,Meets PICOS criteria,The Impact of Persian News on Stock Returns Through Text Mining Techniques,2021,"Azizi, Zahra and Abdolvand, Neda and Ghalibafasl, ...",Iranian Journal of Management Studies
1420,Saxena2021,INCLUDE,Meets PICOS criteria,Stock Market Trend Analysis on Indian Financial News Headlines with Natural Language Processing,2021,"Saxena, Anshul C. and Bhagat, Vandana Vijay and Ta...",
1421,Othan2021,INCLUDE,Meets PICOS criteria,Stock market prediction with new generation deep contextualized word representations and deep learning models using user sentiments,2021,"Othan, Derya and Kilimci, Zeynep Hi̇Lal",
1422,Jiang2021,INCLUDE,Meets PICOS criteria,Machine Learning and Artificial Intelligence Applied in the Research of the Emotions Impact on Forecasting,2021,"Jiang, Yaokui and Zuo, Yi and Yang, Yudong",Journal of Physics: Conference Series
1423,Koratamaddi2021848,INCLUDE,Meets PICOS criteria,Market sentiment-aware deep reinforcement learning approach for stock portfolio allocation,2021,"Koratamaddi, Prahlad and Wadhwani, Karan and Gupta...","Engineering Science and Technology, an International Journal"
1424,Potdar2021,INCLUDE,Meets PICOS criteria,Comprehensive Analysis of Machine Learning Algorithms Used in Robo-Advisory Services,2021,"Potdar, Akhilesh and Pande, Mandaar B.",Journal of Physics: Conference Series
1425,Lee20212560,INCLUDE,Meets PICOS criteria,FedNLP: An Interpretable NLP System to Decode Federal Reserve Communications,2021,"Lee, Jean and Youn, Hoyoul Luis and Stevens, Nicho...",
1426,Kadu20211200,INCLUDE,Meets PICOS criteria,Comparative Study of Stock Price Prediction using Machine Learning,2021,"Kadu, Parag P. and Bamnote, G. R.",
1428,Jazbec2021,INCLUDE,Meets PICOS criteria,On the impact of publicly available news and information transfer to financial markets,2021,"Jazbec, Metod and Pàsztor, Barna and Faltings, Fel...",Royal Society Open Science
1430,Li20215016,INCLUDE,Meets PICOS criteria,Sentiment analysis of Chinese stock reviews based on BERT model,2021,"Li, Mingzheng and Chen, Lei and Zhao, Jing and Li,...",Applied Intelligence
1432,Cheng202173,INCLUDE,Meets PICOS criteria,Sentiment Analysis of Financial Texts Based on Attention Mechanism of FinBERT and BiLSTM,2021,"Cheng, Wenjuan and Chen, Siyi",
1433,Mehta2021,INCLUDE,Meets PICOS criteria,Stock price prediction using machine learning and sentiment analysis,2021,"Mehta, Yashvi and Malhar, Atharva and Shankarmani,...",
1434,Dolabela Dias2021433,INCLUDE,Meets PICOS criteria,Aggregation of Sentiment Analysis Index with Hesitant Fuzzy Sets for Financial Time Series Forecasting,2021,"Dolabela Dias, Breno Costa and Sadaei, Hossein Jav...",
1435,Zhao20211233,INCLUDE,Meets PICOS criteria,A BERT based Sentiment Analysis and Key Entity Detection Approach for Online Financial Texts,2021,"Zhao, Lingyun and Li, Lin and Zheng, Xinhao and Zh...",
1438,Sharaf202117923,INCLUDE,Meets PICOS criteria,StockPred: a framework for stock Price prediction,2021,"Sharaf, Marwa and El-Din Hemdan, Ezz and EL-SAYED,...",Multimedia Tools and Applications
1439,Li20214663,INCLUDE,Meets PICOS criteria,Applying BERT to analyze investor sentiment in stock market,2021,"Li, Menggang and Li, Wenrui and Wang, Fang and Jia...",Neural Computing and Applications
1440,Aasi2021,INCLUDE,Meets PICOS criteria,Stock price prediction using a multivariate multistep LSTM: A sentiment and public engagement analysis model,2021,"Aasi, Bipin and Imtiaz, Syeda Aniqa and Qadeer, Ha...",
1444,Pouromid2021,INCLUDE,Meets PICOS criteria,ParsBERT Post-Training for Sentiment Analysis of Tweets concerning Stock Market,2021,"Pouromid, Mohammadjalal and Yekkehkhani, Arman and...",
1445,Ko20211,INCLUDE,Meets PICOS criteria,LSTM-based sentiment analysis for stock price forecast,2021,"Ko, Ching Ru and Chang, Hsien-Tsung",PeerJ Computer Science
1446,Kinyua2021,INCLUDE,Meets PICOS criteria,An analysis of the impact of President Trump's tweets on the DJIA and S&P 500 using machine learning and sentiment analysis,2021,"Kinyua, Johnson D. and Mutigwe, Charles and Cushin...",Journal of Behavioral and Experimental Finance
1447,Wu20214433,INCLUDE,Meets PICOS criteria,Sentiment analysis of stock markets using a novel dimensional valence–arousal approach,2021,"Wu, Jhenglong and Huang, Mintzu and Yang, Chisheng...",Soft Computing
1448,Ji202123,INCLUDE,Meets PICOS criteria,Sentiment analysis of comments of wooden furniture based on naive Bayesian model,2021,"Ji, Jie and Wang, Haiyan and Song, Shasha and Pi, ...",Progress in Artificial Intelligence
1449,Ezzeddine2021298,INCLUDE,Meets PICOS criteria,Ensemble Learning in Stock Market Prediction,2021,"Ezzeddine, Hassan and Achkar, Roger R.",ACM International Conference Proceeding Series
1452,Houlihan2021433,INCLUDE,Meets PICOS criteria,Leveraging Social Media to Predict Continuation and Reversal in Asset Prices,2021,"Houlihan, Patrick and Creamer, Germán G.",Computational Economics
1454,Jiang2021437,INCLUDE,Meets PICOS criteria,Analysis on relationship between bitcoin price trend and sentiment of bitcoin related tweets by ML and NLP,2021,"Jiang, Nan and Ti, Chang and Mao, Yuxin and Wu, Ti...",
1455,Chowdhury202164,INCLUDE,Meets PICOS criteria,Sentiment Analysis on Bangla Financial News,2021,"Chowdhury, Kibtia and Shatabda, Swakkhar",
1457,Koukaras2021436,INCLUDE,Meets PICOS criteria,Predicting Stock Market Movements with Social Media and Machine Learning,2021,"Koukaras, Paraskevas and Tsichli, Vasiliki and Tjo...","International Conference on Web Information Systems and Technologies, WEBIST - Proceedings"
1459,Yang2021331,INCLUDE,Meets PICOS criteria,ISSPM: A stock prediction model incorporating investor sentiment calculations based on fusedmax,2021,"Yang, Yuer and Chen, Siting and Chen, Zeguang and ...",
1460,Gîfu202144,INCLUDE,Meets PICOS criteria,E-LEARNING ECONOMIC CRISIS,2021,"Gîfu, Daniela",eLearning and Software for Education Conference
1461,Hu2021479,INCLUDE,Meets PICOS criteria,Joint Analysis of Stock Price Predictive Models Using Past Stock Values and Public Sentiments on Twitter,2021,"Hu, Yuetian",
1462,Fernandes2021,INCLUDE,Meets PICOS criteria,Bitcoin Price Prediction,2021,"Fernandes, Mareena and Khanna, Saloni and Monteiro...",
1463,Bi2021642,INCLUDE,Meets PICOS criteria,Predicting Stock Market Movements Through Daily News Headlines Sentiment Analysis: US Stock Market,2021,"Bi, Yubo and Liu, Hanting and Wang, Ruiyang and Li...",
1465,Tahmid2021,INCLUDE,Meets PICOS criteria,A Concern of Predicting Credit Recovery on Supervised Machine Learning Approaches,2021,"Tahmid, Nazre Imam and Haque, Nasimul and Faruque,...",
1466,Anbaee Farimani2021,INCLUDE,Meets PICOS criteria,Leveraging Latent Economic Concepts and Sentiments in the News for Market Prediction,2021,"Anbaee Farimani, Saeede Anbaee and Vafaei Jahan, M...",
1467,Pourroostaei Ardakani2021199,INCLUDE,Meets PICOS criteria,A Data-driven Affective Text Classification Analysis,2021,"Pourroostaei Ardakani, Saeid and Zhou, Can and Wu,...",
1468,Şaşmaz2021613,INCLUDE,Meets PICOS criteria,Tweet Sentiment Analysis for Cryptocurrencies,2021,"Şaşmaz, Emre and Tek, F. Boray",
1469,Bozanta20211253,INCLUDE,Meets PICOS criteria,Sentiment Analysis of StockTwits Using Transformer Models,2021,"Bozanta, Aysun and Angco, Sabrina and Cevik, Mucah...",
1471,Dey2021,INCLUDE,Meets PICOS criteria,Analysis of Machine Learning Algorithms by Developing a Phishing Email and Website Detection Model,2021,"Dey, Nimisha and Samhitha, Srigiri and Hariprasad,...",
1472,Ranjbaran2021102,INCLUDE,Meets PICOS criteria,Analyzing effect of news polarity on stock market prediction: a machine learning approach,2021,"Ranjbaran, Golshid and Moin, Mohammad Shahram and ...",
1473,Linhares Pontes20214570,INCLUDE,Meets PICOS criteria,Contextual Sentence Analysis for the Sentiment Prediction on Financial Data,2021,"Linhares Pontes, Elvys and Benjannet, Mohamed",
