id,citation_key,decision,reason,title,year,author,journal
586,Li2024,EXCLUDE,Review/opinion piece,An interval constraint-based trading strategy with social sentiment for the stock market,2024,"Li, Mingchen and Yang, Kun and Lin, Wencan and Wei...",Financial Innovation
598,Müller2024925,EXCLUDE,Not financial domain,"Legislating landlords: Private interests, issue emphasis, and policy positions",2024,"Müller, Stefan and Ncib, Jihed",Legislative Studies Quarterly
600,Jeldes-Delgado2024,EXCLUDE,Wrong domain: political,Exploring gender stereotypes in financial reporting: An aspect-level sentiment analysis using big data and deep learning,2024,"Jeldes-Delgado, Fabiola and Alves Ferreira, Tiago ...",Heliyon
614,Saleh2024,EXCLUDE,Not financial domain,The Potential of AI in Performing Financial Sentiment Analysis for Predicting Entrepreneur Survival,2024,"Saleh, Lina and Semaan, Samer",Administrative Sciences
617,Kamil20246280,EXCLUDE,Review/opinion piece,"COMPARISON OF LEXICON-BASED METHOD, MACHINE LEARNING AND CHATGPT ON SENTIMENT ANALYSIS OF BIG CAP AND SMALL CAP COMPANIES IN UNITED STATE INDEXES",2024,"Kamil, Imran and Shah, Nathar",Journal of Theoretical and Applied Information Technology
620,Delgadillo2024,EXCLUDE,Wrong domain: political,FinSoSent: Advancing Financial Market Sentiment Analysis through Pretrained Large Language Models,2024,"Delgadillo, Josiel and Kinyua, Johnson D. and Muti...",Big Data and Cognitive Computing
624,Garg2024902,EXCLUDE,Review/opinion piece,A Hybrid Model of Integrating Sentiment Analysis and Key Market Indicators for IPO Listing Trend Prediction,2024,"Garg, Ashish and Ghanshala, Kamal Kumar and Sharma...","International Journal of Mathematical, Engineering and Management Sciences"
626,Shobharani2024,EXCLUDE,Review/opinion piece,Meta heuristic approaches for sentiment analysis,2024,"Shobharani, Meesala Shobha and Subramanian, Sumath...",Expert Systems
635,Krynytsia2024186,EXCLUDE,Not financial domain,LEVERAGING BIG DATA TECHNOLOGIES FOR ENHANCED PUBLIC PARTICIPATION IN PUBLIC FINANCIAL MANAGEMENT,2024,"Krynytsia, Sergii and Hordei, Oksana and Kovalenko...",Financial and Credit Activity: Problems of Theory and Practice
642,Zuo2024158,EXCLUDE,Review/opinion piece,Emoji driven crypto assets market reactions,2024,"Zuo, Xiaorui and Chen, Yaotsung and Härdle, Wolfga...",Management and Marketing
647,Das20243606,EXCLUDE,No sentiment analysis,Negative Review or Complaint? Exploring Interpretability in Financial Complaints,2024,"Das, Sarmistha and Singh, Apoorva and Saha, Sripar...",IEEE Transactions on Computational Social Systems
649,Xiao202476,EXCLUDE,Review/opinion piece,A Comparative Review of Advanced Techniques for Financial Sentiment Analysis,2024,"Xiao, Weizhen",
652,Joshi20243847,EXCLUDE,No performance evaluation,DEEP LEARNING FOR SENTIMENT BASED DYNAMIC STOCK SYMBOL ANALYSIS,2024,"Joshi, Paul and Maria, Santa and Lakshmi, K. S. an...",Journal of Theoretical and Applied Information Technology
655,Sonar2024,EXCLUDE,No sentiment analysis,Stock Trade Recommendations using Knowledge Graph and Graph Neural Network,2024,"Sonar, Rahul and Menaria, Sumitra and Shukla, Shal...",AIP Conference Proceedings
662,Vaca20247509,EXCLUDE,Not financial domain,Interpretability of deep learning models in analysis of Spanish financial text,2024,"Vaca, Cesar and Astorgano, Manuel and Rivero, Alfo...",Neural Computing and Applications
665,Li2024,EXCLUDE,Review/opinion piece,Adding double insurance to your investments: Evidence from the exchange rate market,2024,"Li, Mingchen and Yang, Kun and Cheng, Zishu and We...",Advanced Engineering Informatics
669,Sai Somayajulu2024,EXCLUDE,No performance evaluation,Cryptocurrency price prediction using the technique of deep learning and sentiment analysis,2024,"Sai Somayajulu, Meduri V.N.S.S.R.K. and Kotaiah, B...",AIP Conference Proceedings
671,Abdelfattah2024116,EXCLUDE,Review/opinion piece,Enhancing the Prediction of Stock Market Movement Using Neutrosophic-Logic-Based Sentiment Analysis,2024,"Abdelfattah, Bassant A. and Darwish, Saad Mohamed ...",Journal of Theoretical and Applied Electronic Commerce Research
677,Wu2024,EXCLUDE,Review/opinion piece,Modeling crude oil volatility using economic sentiment analysis and opinion mining of investors via deep learning and machine learning models,2024,"Wu, Wei and Xu, Meiqi and Su, Ruiqian and Ullah, K...",Energy
682,Sadigov2024443,EXCLUDE,Not financial domain,Deep learning-based user experience evaluation in distance learning,2024,"Sadigov, Rahim and Yıldırım, Elif and Kocaçinar, B...",Cluster Computing
685,Regulagadda2024414,EXCLUDE,No performance evaluation,Predictive Analytics in Stock Markets: Unleashing the Power of IoT and Machine Learning,2024,"Regulagadda, Ramakrishna and Veeraiah, Vivek and M...",International Journal of Intelligent Systems and Applications in Engineering
687,Ni2024,EXCLUDE,Not financial domain,Sentiment Dynamics Among Informal Caregivers in Web-Based Alzheimer Communities: Systematic Analysis of Emotional Support and Interaction Patterns,2024,"Ni, Congning and Song, Qingyuan and Chen, Qingxia ...",JMIR Aging
688,Abdelsamie2024,EXCLUDE,Not financial domain,Comparative Analysis of LLM-based Market Prediction and Human Expertise with Sentiment Analysis and Machine Learning Integration,2024,"Abdelsamie, Mohamed and Wang, Hua",
689,Das2024,EXCLUDE,Review/opinion piece,Utilizing Machine Learning to Analyze Investor Sentiment and Detect Market Anomalies,2024,"Das, Tapas and Jeelani, Saidia and Das, Seshanwita...",
690,Hadji202422,EXCLUDE,Review/opinion piece,Sentiment Analysis of Digital Currency Discussions: A Machine Learning and Ontology Approaches,2024,"Hadji, Atmane and Boumaza, Farid and Bali, Dina Si...",CEUR Workshop Proceedings
701,Dmonte20244869,EXCLUDE,Not financial domain,An Evaluation of Large Language Models in Financial Sentiment Analysis,2024,"Dmonte, Alphaeus and Ko, Eunmi and Zampieri, Marco...",
705,Waseem2024118,EXCLUDE,No performance evaluation,Advanced Predictive Modelling for Bitcoin and Ethereum Price Dynamics,2024,"Waseem, Mohd and Singh, Shailendra Narayan",
710,Shah2024544,EXCLUDE,Not financial domain,Optimized Hindi Negation Detection Using a Hybrid Rule-Based and BERT Model,2024,"Shah, Nirja and Pareek, Jyoti S.",
716,Sushma20241175,EXCLUDE,Review/opinion piece,"A Comprehensive Review of Sentiment Analysis: Trends, Challenges, and Future Directions",2024,"Sushma, S. and Nayak, Sasmita Kumari and Vamsikris...",
718,Shen2024717,EXCLUDE,Not financial domain,Financial Sentiment Analysis on News and Reports Using Large Language Models and FinBERT,2024,"Shen, Yanxin and Zhang, Pulin Kirin",
730,Ndama2024204,EXCLUDE,Review/opinion piece,Advanced NLP and N-Gram Techniques in Financial News Sentiment Analysis: Diverse Machine Learning Approaches,2024,"Ndama, Oussama and En-Naimi, El Mokhtar",Communications in Computer and Information Science
731,Ouf2024207,EXCLUDE,Review/opinion piece,A Deep Learning-Based LSTM for Stock Price Prediction Using Twitter Sentiment Analysis,2024,"Ouf, Shimaa and Hawary, Mona El and Aboutabl, Amal...",International Journal of Advanced Computer Science and Applications
735,Anwar2024,EXCLUDE,Not financial domain,Machine Learning Models for Sentiment Analysis: State of the Art and Applications,2024,"Anwar, Khalid and Garg, Arushi and Wasid, Mohammed...",
736,Elizabeth2024353,EXCLUDE,Not financial domain,Cellular Automaton-Based Sentiment Analysis Using Deep Learning Methods,2024,"Elizabeth, M. J. and Hazari, Raju",Complex Systems
742,Bulkrock202415,EXCLUDE,Not financial domain,A Natural Language Processing Approach for Sentiment Analysis of Hotel Reviews,2024,"Bulkrock, Olla and Alsharman, Nesreen Mohammad",International Journal of Advances in Soft Computing and its Applications
746,Van2024437,EXCLUDE,Review/opinion piece,Studying the Influence of Vietnamese Social Media on Vietnamese Stock Market to Forecast Market Trends,2024,"Van, Cuong Bui and do Cao, Trung Do and Thi, Tuyet...",Lecture Notes in Networks and Systems
747,Musawa2024214,EXCLUDE,Not financial domain,Exploring Transformer-Based Model in Sentiment Analysis of Movie Review,2024,"Musawa, Ali Hadi and Ricky, null and Iswanto, Iren...",
750,Bora2024,EXCLUDE,Review/opinion piece,Analyzing Market Sentiment for Gold Commodity News Through Natural Language Processing Techniques,2024,"Bora, Mohit and Rawat, Praveen Singh and Rawat, Da...",
757,Khan20242802,EXCLUDE,Review/opinion piece,Sentiment Analysis of Stock Market: Extracting and Deciphering Market Sentiments from Digital Seas,2024,"Khan, Emran and Ailawalia, Praveen",
758,Hassan2024,EXCLUDE,Not financial domain,ENHANCING NATURAL LANGUAGE PROCESSING USING WALRUS OPTIMIZER with SELF-ATTENTION DEEP LEARNING MODEL in APPLIED LINGUISTICS,2024,"Hassan, Abdulkhaleq Q.A. and Alshammari, Alya K. a...",Fractals
762,Paulraj202418,EXCLUDE,Not financial domain,Temporal Dynamics in Financial Sentiment Analysis Using Deep Learning Approaches,2024,"Paulraj, Balachandar","Proceedings of the IEEE International Conference on Software Engineering and Service Sciences, ICSESS"
773,Dagar2024,EXCLUDE,Wrong domain: medical,Development of a CNN Model for Efficient Leaf Disease Detection,2024,"Dagar, Ishant and Sharma, Harsh and Gusain, Raj an...",
777,Anis2024118,EXCLUDE,Not financial domain,Fintech Sentiment Analysis Using Deep Learning Approaches: A Survey,2024,"Anis, Sarah and Morsey, Mohamed Mabrouk and Aref, ...",
778,Beniwal2024,EXCLUDE,Review/opinion piece,A Hybrid Deep Learning Model for Sentiment Analysis of IMDB Movies Reviews,2024,"Beniwal, Rohit S. and Dinkar, Arpit Kumar and Kuma...",
781,Miao2024,EXCLUDE,Wrong domain: political,Investor Sentiment Analysis of Financial Texts Based on GPT and RoBERTa,2024,"Miao, Jia and Lin, Jianwu and Luo, Tong and Liu, G...",Proceedings of the International Joint Conference on Neural Networks
786,Chen20247455,EXCLUDE,Not financial domain,EFSA: Towards Event-Level Financial Sentiment Analysis,2024,"Chen, Tianyu and Zhang, Yiming and Yu, Guoxin and ...",Proceedings of the Annual Meeting of the Association for Computational Linguistics
791,Garg2024,EXCLUDE,Not financial domain,Exploring Machine Learning Models for Intelligent Sentiment Analysis in Financial Services,2024,"Garg, Amit X. and Dhanasekaran, S. and Gupta, Rish...",
793,Bharathi Mohan2024,EXCLUDE,Review/opinion piece,Sentiment-Driven Predictive Models for Nifty 50 Stock Market Fluctuations: A Time Series Analysis Perspective,2024,"Bharathi Mohan, G. and Yadav, Abhivyakti and Tolet...",
794,Huang2024,EXCLUDE,Not financial domain,"Sentiment Analysis on Digital Transformation Announcements with Dictionary Method, Machine Learning, and Large Language Models",2024,"Huang, Chengkui Tony and Kuo, Chien Jen",
795,Dangi2024253,EXCLUDE,No performance evaluation,Review on sentiment analysis of movie reviews using machine learning techniques based on data available on Twitter,2024,"Dangi, Dharmendra and Bhagat, Amit and Kumar, Jeet...",International Journal of Engineering Systems Modelling and Simulation
797,Minsoor2024352,EXCLUDE,Review/opinion piece,An Efficient Algorithm for Stock Market Prediction Using Attention Mechanism,2024,"Minsoor, Zena Kreem and Al-Sultan, Ali Yakoob",Journal of Cybersecurity and Information Management
804,Muljono2024646,EXCLUDE,Review/opinion piece,Aspect-Based Sentiment Analysis for Financial Review with Implicit Aspect and Opinion Using Semantic Similarity and Hybrid Approach,2024,"Muljono, Muljono and Harjo, Budi and Abdullah, Rac...",International Journal of Intelligent Engineering and Systems
808,Sufian2024231,EXCLUDE,Review/opinion piece,Bridging Social Media and Cryptocurrency: A Deep Learning-Based Twitter Sentiment Analysis for Bitcoin Market,2024,"Sufian, Md Abu and Miah, Md Sipon and Niu, Mingbo",Lecture Notes in Networks and Systems
810,Mondal2024173,EXCLUDE,Not financial domain,Comparative Analysis of Financial Datasets Predictive Modeling Using Feature Extraction Methods,2024,"Mondal, Anupam and Mahata, Sainik Kumar and Dey, M...",Lecture Notes in Electrical Engineering
824,Aakash2024709,EXCLUDE,Review/opinion piece,Forecasting Bitcoin Price Trends: Integrating Sentiment Analysis and Machine Learning,2024,"Aakash, Kasukurthy G. and Reyana, A.",
826,Meghani20241264,EXCLUDE,No performance evaluation,Smart Crop Cultivation: Harnessing Machine and Deep Learning for Informed Agricultural Practices,2024,"Meghani, Smit and Vele, Jay and Madrecha, Kunal an...",
827,Zhong2024306,EXCLUDE,No sentiment analysis,Large Language Model for Dynamic Strategy Interchange in Financial Markets,2024,"Zhong, Xingyu and Zhao, Zongyi and Yan, Bingda and...",
829,Hollander2024115,EXCLUDE,Review/opinion piece,Data Augmentation Using BERT-Based Models for Aspect-Based Sentiment Analysis,2024,"Hollander, Bron and Frasincar, Flavius and van der...",Lecture Notes in Computer Science
836,Mohagheghzadeh202483022,EXCLUDE,Review/opinion piece,A Novel Dynamic Model for Ranking Cryptocurrencies in Different Time Horizons Based on Deep Learning and Sentiment Analysis,2024,"Mohagheghzadeh, Aida and Amiri, Babak and Makui, A...",IEEE Access
839,Sanjana2024435,EXCLUDE,Review/opinion piece,Prediction Using Sentiment Analysis on Multi-domain Category: Stocks and Politics Using Twitter Repository,2024,"Sanjana, G. Monika and Kumar, I. L.V.Sai and Nymis...",Springer Proceedings in Mathematics and Statistics
840,Kumar2024317,EXCLUDE,Wrong domain: general social media,Bitcoin Price Prediction Using Sentiment Analysis,2024,"Kumar, Rishabh Udhaya and Marken, Gagandeep and Si...",Lecture Notes in Networks and Systems
853,Govinda2024,EXCLUDE,No performance evaluation,Sentiment Analysis on Reddit Trading Data,2024,"Govinda, K. and Chintalapati, Akhil and Senapati, ...",
858,Huang202457,EXCLUDE,Review/opinion piece,From Tweets to Token Sales: Assessing ICO Success Through Social Media Sentiments,2024,"Huang, Donghao and Samuel, Samuel and Hyunh, Quoc ...",Lecture Notes in Computer Science
861,Bedford2024914,EXCLUDE,Review/opinion piece,Training a Neural Network to Perform Sentiment Analysis of Stocks-Related Tweets,2024,"Bedford, Wilson Wade and Jackson, Nick and Pitts, ...",Conference Proceedings - IEEE SOUTHEASTCON
864,Zhang2024170,EXCLUDE,Wrong domain: product review,Fine-Grained Sentiment Analysis for Enhanced Financial Distress Prediction,2024,"Zhang, Ming and Jiazhen, Chen and Palade, Vasile",
866,Al-Alawi2024542,EXCLUDE,Review/opinion piece,Stock Price Prediction Using Artificial Intelligence: A Literature Review,2024,"Al-Alawi, Adel Ismail and Alshakhoori, Naser",
868,Vakare2024138,EXCLUDE,Review/opinion piece,Sentiment Analysis of Crypto Currency Trading Applications in India Using Machine Learning,2024,"Vakare, Gourav and Khan, Faraz and Naikwade, Aarad...",Communications in Computer and Information Science
869,Moodi2024,EXCLUDE,Review/opinion piece,A CNN-LSTM deep neural network with technical indicators and sentiment analysis for stock price forecastings,2024,"Moodi, Fatemeh and Jahangard-Rafsanjani, Amir and ...",
872,Ahmed2024,EXCLUDE,Not financial domain,Leveraging Large Language Models and Prompt Settings for Context-Aware Financial Sentiment Analysis,2024,"Ahmed, Rabbia and Abdul Rauf, Sadaf and Latif, See...",
876,Rouzegar202498,EXCLUDE,Not financial domain,Enhancing Text Classification through LLM-Driven Active Learning and Human Annotation,2024,"Rouzegar, Hamidreza and Makrehchi, Masoud",
878,Awais202461198,EXCLUDE,Not financial domain,Abstractive Text Summarization for the Urdu Language: Data and Methods,2024,"Awais, Muhammad and Muhammad Adeel Nawab, Rao",IEEE Access
879,Tanawade2024405,EXCLUDE,Review/opinion piece,Share Market Application Using Machine Learning,2024,"Tanawade, Shraddha S. and Pingale, Subhash V.",Lecture Notes in Electrical Engineering
881,Raju2024,EXCLUDE,Not financial domain,Evaluation of Machine Learning Techniques for Enhancing Scholarship Schemes Using Artificial Emotional Intelligence,2024,"Raju, P. Samuel and Patra, Sanjay Kumar and Patra,...",EAI Endorsed Transactions on Internet of Things
883,Arjmand2024,EXCLUDE,Review/opinion piece,"Bitcoin price prediction based on financial data, technical indicators, and news headlines sentiment analysis using CNN and GRU deep learning algorithms",2024,"Arjmand, Masoud and Kazeminia, Saman and Sajedi, H...",
884,Azad2024105,EXCLUDE,Not financial domain,The Effectiveness of GPT-4 as Financial News Annotator Versus Human Annotator in Improving the Accuracy and Performance of Sentiment Analysis,2024,"Azad, Satyajeet",Lecture Notes in Networks and Systems
888,Popoola2024,EXCLUDE,Review/opinion piece,Sentiment Analysis of Financial News Data using TF-IDF and Machine Learning Algorithms,2024,"Popoola, Gideon and Abdullah, Khadijah Kuburat A. ...",
890,Liu202445,EXCLUDE,No sentiment analysis,Social Media Analysis: The Relationship Between Private Investors and Stock Price,2024,"Liu, Zijun and Wu, Xinxin and Yao, Wei",Lecture Notes in Computer Science
894,Habberrih2024137,EXCLUDE,Not financial domain,Sentiment Analysis of Arabic Dialects: A Review Study,2024,"Habberrih, Abdullah and Abuzaraida, Mustafa Ali",Communications in Computer and Information Science
897,Batmetan2024122,EXCLUDE,Review/opinion piece,Sentiment Unleashed: Electric Vehicle Incentives Under the Lens of Support Vector Machine and TF-IDF Analysis,2024,"Batmetan, Johan Reimon and Hariguna, Taqwa",Journal of Applied Data Sciences
900,Balcı2024,EXCLUDE,Not financial domain,The Impact of Turkish Economic News on the Fractality of Borsa Istanbul: A Multidisciplinary Approach,2024,"Balcı, Mehmet Ali and Akgüller, Akgü and Bǎtrâncea...",Fractal and Fractional
903,Rizinski20247170,EXCLUDE,Not financial domain,Sentiment Analysis in Finance: From Transformers Back to eXplainable Lexicons (XLex),2024,"Rizinski, Marjan and Peshov, Hristijan and Mishev,...",IEEE Access
904,Saldana-Perez2024591,EXCLUDE,Not financial domain,Reinforcing Tourism Post-pandemic Through a Natural Language Processing Data Analysis,2024,"Saldana-Perez, Magdalena and Moreno Ibarra, Marco ...",Springer Proceedings in Complexity
905,Busst20243528,EXCLUDE,Not financial domain,Ensemble BiLSTM: A Novel Approach for Aspect Extraction From Online Text,2024,"Busst, Mikail Muhammad Azman and Anbananthen, Kala...",IEEE Access
907,Vazirani202469,EXCLUDE,Not financial domain,Evaluating the economic disparities in the world: sentiment analysis on central bank speeches from third world and first world countries,2024,"Vazirani, Krish",International Journal of Information Technology (Singapore)
912,Wani2024305,EXCLUDE,Not financial domain,CoDeS: A Deep Learning Framework for Identifying COVID-Caused Depression Symptoms,2024,"Wani, Mudasir Ahmad and El-Affendi, Mohammed Ahmed...",Cognitive Computation
920,Qu2024191,EXCLUDE,Not financial domain,A Corpus-Based Machine-Learning Sentiment Analysis of Chinese News Portraying African Island Nations' Economic Images,2024,"Qu, Ying and Liu, Xiqin",
921,Raj2024349,EXCLUDE,Review/opinion piece,Enhanced Stock Market Prediction: Integration of PCA with Random Forest Classifiers for Complex Pattern Recognition,2024,"Raj, Sanjana",
924,Jimale2024503,EXCLUDE,No sentiment analysis,Data-to-Text: A Constrained Approach to Diverse Candidate Text Generation and Ranking,2024,"Jimale, Elias Lemuye and Liu, Qiao and Chen, Wenyu","Proceedings of the IEEE International Conference on Computer and Communications, ICCC"
926,Vysotska2024,EXCLUDE,No performance evaluation,A Study of the Effectiveness of Using Information Technology Based on Artificial Intelligence for Bitcoin Price Forecasting,2024,"Vysotska, Victoria and Smelyakov, Kirill S. and Na...",International Scientific and Technical Conference on Computer Sciences and Information Technologies
934,Gowda2024,EXCLUDE,No performance evaluation,A Comprehensive Examination of Deep Learning Techniques for Sentiment Analysis on Twitter Data,2024,"Gowda, Mahima M. and Pushpa, D. P.",
942,Wijaya2024,EXCLUDE,Wrong domain: political,Stock Buy/Sell Prediction Based on Technical Analysis and News Sentiment Using Deep Learning,2024,"Wijaya, Arya Yudhi and Navastara, Dini Adni and Ha...",
944,Le2024211,EXCLUDE,Wrong domain: political,Gold Price Forecasting in Uncertain Times: Integrating Sentiment Analysis and External Indices,2024,"Le, Dat and Rajasegarar, Sutharshan and Luo, Wei a...","Proceedings of the International Conference on Soft Computing and Machine Intelligence, ISCMI"
946,Patil2024548,EXCLUDE,Review/opinion piece,A Systematic Review of Data Augmentation Techniques in Natural Language Processing for Sentiment Analysis using Machine learning Techniques,2024,"Patil, Uday Dhanaji and Sudhakaran, Pradeep",
952,Oei2024,EXCLUDE,No performance evaluation,Exploring the Effectiveness of Adding Sentiment Analysis and Trends into Random Forest Machine Learning Algorithm to Predict Bitcoin Price Action,2024,"Oei, Vincent and Effendy, Pieter and Wulandhari, L...",
954,Nhat-Hai202441,EXCLUDE,Not financial domain,ViFin-Gen: Efficient Vietnamese Instruction Dataset Generation Pipeline for Finance Domain,2024,"Nhat-Hai, Nguyen and Thu, Nguyen Thi Hoai and Son,...",International Conference on Advanced Technologies for Communications
956,Dash2024,EXCLUDE,Review/opinion piece,Application of NLU based Sentiment Analysis in the Hybrid Stock Price Forecasting Model using Deep Learning Model,2024,"Dash, Anupa S. and Mishra, Ujjwal",
957,Vu202468,EXCLUDE,Not financial domain,Sentiment Analysis using Machine Learning and Deep Learning Models,2024,"Vu, Hoangdieu and Pham, Quang Tu and Solanki, Vije...",
963,Chu202371,EXCLUDE,Not financial domain,Leveraging rule-based model and machine learning transformer for mining aspect-based financial opinions in colloquial language,2023,"Chu, Carlin Chun Fai and So, Raymond and Kwong, Er...",
967,Chahal2023,EXCLUDE,Review/opinion piece,Using Social Media to Predict Social Unrest: A Survey,2023,"Chahal, Ravneet Kaur and Singh, Harmandeep",AIP Conference Proceedings
970,Tsai2023,EXCLUDE,Wrong domain: political,Stock Selection Using Machine Learning Based on Financial Ratios,2023,"Tsai, Peifen and Gao, Chenghan and Yuan, Shyan Min...",Mathematics
974,Gössi2023357,EXCLUDE,Not financial domain,FinBERT-FOMC: Fine-Tuned FinBERT Model with Sentiment Focus Method for Enhancing Sentiment Analysis of FOMC Minutes,2023,"Gössi, Sandro and Chen, Ziwei and Kim, Wonseong an...",
978,Karanikola2023893,EXCLUDE,Not financial domain,Financial sentiment analysis: Classic methods vs. deep learning models,2023,"Karanikola, Aikaterini and Davrazos, Gregory N. an...",Intelligent Decision Technologies
980,Reddy2023,EXCLUDE,Not financial domain,Financial decision making with social media posts using decision tree and compare prediction accuracy with K-nearest neighbor,2023,"Reddy, Vajrala Sudheer Kumar and Priyadarsini, Ps ...",AIP Conference Proceedings
986,Liapis2023,EXCLUDE,Wrong domain: political,Temporal Convolutional Networks and BERT-Based Multi-Label Emotion Analysis for Financial Forecasting,2023,"Liapis, Charalampos M. and Kotsiantis, Sotiris B.",Information (Switzerland)
998,Washington2023,EXCLUDE,Review/opinion piece,Analyzing influence of COVID-19 on crypto & financial markets and sentiment analysis using deep ensemble model,2023,"Washington, Patrick Bernard and Gali, Pradeep Kuma...",PLOS ONE
1002,Lengkeek2023,EXCLUDE,Not financial domain,Leveraging hierarchical language models for aspect-based sentiment analysis on financial data,2023,"Lengkeek, Matteo and van der Knaap, Finn and Frasi...",Information Processing and Management
1004,Zammarchi20231001,EXCLUDE,Wrong domain: medical,Using sentiment analysis to evaluate the impact of the COVID-19 outbreak on Italy’s country reputation and stock market performance,2023,"Zammarchi, Gianpaolo and Mola, Francesco and Conve...",Statistical Methods and Applications
1005,Vijay2023,EXCLUDE,Review/opinion piece,Study on various stock prediction techniques with news sentiment,2023,"Vijay, K. V. and Shanthi, D. Sorna and Vijay, Priy...",AIP Conference Proceedings
1012,Chawla202330831,EXCLUDE,Wrong domain: political,A hybrid framework for bot detection on twitter: Fusing digital DNA with BERT,2023,"Chawla, Vaishali and Kapoor, Yatin",Multimedia Tools and Applications
1016,Leippold2023,EXCLUDE,Not financial domain,Sentiment spin: Attacking financial sentiment with GPT-3,2023,"Leippold, Markus",Finance Research Letters
1020,Du2023,EXCLUDE,Not financial domain,Incorporating Multiple Knowledge Sources for Targeted Aspect-based Financial Sentiment Analysis,2023,"Du, Kelvin and Xing, Frank Z. and Cambria, Erik",ACM Transactions on Management Information Systems
1022,Niţoi2023,EXCLUDE,Not financial domain,Unveiling the sentiment behind central bank narratives: A novel deep learning index,2023,"Niţoi, Mihai and Pochea, Maria Miruna and Radu, Șt...",Journal of Behavioral and Experimental Finance
1025,Chen2023129,EXCLUDE,Wrong domain: political,A CEP-driven framework for real-time news impact prediction on financial markets,2023,"Chen, Weisi and El Majzoub, Ahmad and Al-Qudah, Is...",Service Oriented Computing and Applications
1026,Rahaman20231762,EXCLUDE,Review/opinion piece,Bitcoin trading indicator: a machine learning driven real time bitcoin trading indicator for the crypto market,2023,"Rahaman, Ashikur and Kowshir Bitto, Abu Kowshir an...",Bulletin of Electrical Engineering and Informatics
1027,García-Méndez2023,EXCLUDE,No sentiment analysis,Targeted aspect-based emotion analysis to detect opportunities and precaution in financial Twitter messages,2023,"García-Méndez, Silvia and de Arriba-Pérez, Francis...",Expert Systems with Applications
