id,citation_key,decision,reason,title,year,author,journal
631,Sharma2024,INCLUDE,Meets PICOS criteria,"Analyzing technical, sentimental, and machine learning algorithms for stock market prediction",2024,"Sharma, Akshat and Lohumi, Yogesh and Gangodkar, D...",AIP Conference Proceedings
632,Peng2024,INCLUDE,Meets PICOS criteria,Supervised Cross-Momentum Contrast: Aligning representations with prototypical examples to enhance financial sentiment analysis,2024,"Peng, Bo and Chersoni, Emmanuele and Hsu, Yuyin an...",Knowledge-Based Systems
633,Xia2024,INCLUDE,Meets PICOS criteria,Mining the relationship between COVID-19 sentiment and market performance,2024,"Xia, Ziyuan and Chen, Jeffrey and Sun, Anchen",PLOS ONE
634,Liu202415613,INCLUDE,Meets PICOS criteria,A sentiment analysis model based on dynamic pre-training and stacked involutions,2024,"Liu, Shiyu and Liu, Qicheng",Journal of Supercomputing
636,Liu2024455,INCLUDE,Meets PICOS criteria,Multi-feature fusion stock prediction based on knowledge graph,2024,"Liu, Zhenghao and Qian, Yuxing and Lv, Wenlong and...",Electronic Library
637,Bhat202467,INCLUDE,Meets PICOS criteria,Stock Price Trend Prediction using Emotion Analysis of Financial Headlines with Distilled LLM Model,2024,"Bhat, Rithesh and Jain, Bhanu",
638,Chung20242017,INCLUDE,Meets PICOS criteria,Application of deep learning and statistical methods in predicting Taiwanese stock trends,2024,"Chung, Yaoliang and Wu, Zhenglin and Pichappan, Pi...",Journal of Computational Methods in Sciences and Engineering
639,Baruah202445,INCLUDE,Meets PICOS criteria,VADER SENTIMENT ANALYSIS ON TWITTER: PREDICTING PRICE TRENDS AND DAILY RETURNS IN INDIA’S STOCK MARKET,2024,"Baruah, Amlan and Changkakati, Banajit",Bangladesh Journal of Multidisciplinary Scientific Research
640,Nguyen Phuong2024,INCLUDE,Meets PICOS criteria,Predicting Bitcoin price movement through Sentiment Analysis: A Comprehensive Study,2024,"Nguyen Phuong, Hanh and Asemi, Asefeh and AlShafee...",
641,Meeradevi20241952,INCLUDE,Meets PICOS criteria,Evaluating the machine learning models based on natural language processing tasks,2024,"Meeradevi, null and Sowmya, B. J. and Swetha, B. N...",IAES International Journal of Artificial Intelligence
643,Smatov2024,INCLUDE,Meets PICOS criteria,Development of Context-Based Sentiment Classification for Intelligent Stock Market Prediction,2024,"Smatov, Nurmaganbet and Kalashnikov, Ruslan and Ka...",Big Data and Cognitive Computing
644,Roumeliotis2024,INCLUDE,Meets PICOS criteria,LLMs and NLP Models in Cryptocurrency Sentiment Analysis: A Comparative Classification Study,2024,"Roumeliotis, Konstantinos I. and Tselikas, Nikolao...",Big Data and Cognitive Computing
645,Dorfleitner2024197,INCLUDE,Meets PICOS criteria,ESG News Sentiment and Stock Price Reactions: A Comprehensive Investigation via BERT,2024,"Dorfleitner, Gregor and Zhang, Rongxin",Schmalenbach Journal of Business Research
646,Chatziloizos2024,INCLUDE,Meets PICOS criteria,Deep Learning for Stock Market Prediction Using Sentiment and Technical Analysis,2024,"Chatziloizos, Georgios Markos and Gunopulos, Dimit...",SN Computer Science
648,Li20244087,INCLUDE,Meets PICOS criteria,SEHF: A Summary-Enhanced Hierarchical Framework for Financial Report Sentiment Analysis,2024,"Li, Haozhou and Peng, Qinkke and Wang, Xinyuan and...",IEEE Transactions on Computational Social Systems
650,Zhao2024351,INCLUDE,Meets PICOS criteria,NASDAQ 100 Index Prediction Using LSTM And Sentiment Analysis,2024,"Zhao, Fuzhe and Xu, Han and Huang, Zhaoge and Yang...",
651,Yan2024566,INCLUDE,Meets PICOS criteria,Sentiment Analysis of Financial Media Commentary Text Based on FinBERT-BiGRU-CNN,2024,"Yan, Yiling and Qin, Qiuli",
653,Sudheer Kumar Reddy2024,INCLUDE,Meets PICOS criteria,Financial risk prediction using decision tree with Twitter data and compare prediction accuracy with random forest,2024,"Sudheer Kumar Reddy, Vajrala and Priyadarsini, Ps ...",AIP Conference Proceedings
654,Patel2024,INCLUDE,Meets PICOS criteria,A Comprehensive Survey of Predicting Stock Market Prices: An Analysis of Traditional Statistical Models and Machine-Learning Techniques,2024,"Patel, Divy and Patel, Warish D. and Koyuncu, Haka...",AIP Conference Proceedings
656,Fu2024,INCLUDE,Meets PICOS criteria,Incorporating Multi-Source Market Sentiment and Price Data for Stock Price Prediction,2024,"Fu, Kui and Zhang, Yanbin",Mathematics
657,Papageorgiou2024,INCLUDE,Meets PICOS criteria,Enhancing Stock Market Forecasts with Double Deep Q-Network in Volatile Stock Market Environments,2024,"Papageorgiou, George and Gkaimanis, Dimitrios and ...",Electronics (Switzerland)
658,Cai2024,INCLUDE,Meets PICOS criteria,Can real-time investor sentiment help predict the high-frequency stock returns? Evidence from a mixed-frequency-rolling decomposition forecasting method,2024,"Cai, Yi and Tang, Zhenpeng and Chen, Ying",North American Journal of Economics and Finance
659,Souza2024,INCLUDE,Meets PICOS criteria,Using social media and machine learning to understand sentiments towards Brazilian National Parks,2024,"Souza, Carolina Neves and Martínez-Arribas, Javier...",Biological Conservation
660,Haas2024,INCLUDE,Meets PICOS criteria,How to select oil price prediction models — The effect of statistical and financial performance metrics and sentiment scores,2024,"Haas, Christian and Budin, Constantin and D'Arcy, ...",Energy Economics
661,Xu2024,INCLUDE,Meets PICOS criteria,An emoji feature-incorporated multi-view deep learning for explainable sentiment classification of social media reviews,2024,"Xu, Qianwen Ariel and Jayne, Chrisina and Chang, V...",Technological Forecasting and Social Change
663,Kirtac2024,INCLUDE,Meets PICOS criteria,Sentiment trading with large language models,2024,"Kirtac, Kemal and Germano, Guido",Finance Research Letters
664,Sheng2024,INCLUDE,Meets PICOS criteria,Stock price crash prediction based on multimodal data machine learning models,2024,"Sheng, Yankai and Qu, Yuanyu and Ma, Ding",Finance Research Letters
666,Kumar202434691,INCLUDE,Meets PICOS criteria,A hybrid framework for time series trends: embedding social network’s sentiments and optimized stacked LSTM using evolutionary algorithm,2024,"Kumar, Pardeep and Kumar, Raghavendra",Multimedia Tools and Applications
667,Khan2024477,INCLUDE,Meets PICOS criteria,Users Sentiment Analysis Using Artificial Intelligence-Based FinTech Data Fusion in Financial Organizations,2024,"Khan, Sulaiman and Khan, Habib Ullah and Nazir, Sh...",Mobile Networks and Applications
668,Yang2024,INCLUDE,Meets PICOS criteria,Can public opinions improve the effect of financial early warning ? – an empirical study on the new energy industry,2024,"Yang, Ziya and Zhu, Yucheng and Chen, Jiaxin and X...",Heliyon
670,Gao2024447,INCLUDE,Meets PICOS criteria,ADAPTING TO UNCERTAINTY: A QUANTITATIVE INVESTMENT DECISION MODEL WITH INVESTOR SENTIMENT AND ATTENTION ANALYSIS,2024,"Gao, Jie and Bai, Xiuran and Tan, Huimin and Fan, ...",Technological and Economic Development of Economy
672,Bâra2024538,INCLUDE,Meets PICOS criteria,The Impact of Academic Publications over the Last Decade on Historical Bitcoin Prices Using Generative Models,2024,"Bâra, Adela and Oprea, Simona Vasilica",Journal of Theoretical and Applied Electronic Commerce Research
673,Todd2024,INCLUDE,Meets PICOS criteria,Text-based sentiment analysis in finance: Synthesising the existing literature and exploring future directions,2024,"Todd, Andrew and Bowden, James and Moshfeghi, Yash...","Intelligent Systems in Accounting, Finance and Management"
674,Ullah2024,INCLUDE,Meets PICOS criteria,Nexus between Chat GPT usage dimensions and investment decisions making in Pakistan: Moderating role of financial literacy,2024,"Ullah, Rafid and Ismail, Hishamuddin Bin and Khan,...",Technology in Society
675,Fischmann2024,INCLUDE,Meets PICOS criteria,Emotion regulation and cheap talk as signaling strategies: Evidence from crowdfunding for Ukraine,2024,"Fischmann, Alexandra and Xu, Larry Zhiming",Telematics and Informatics
676,Luo2024366,INCLUDE,Meets PICOS criteria,A multisource data-driven combined forecasting model based on internet search keyword screening method for interval soybean futures price,2024,"Luo, Rui and Liu, Jinpei and Wang, Piao and Tao, Z...",Journal of Forecasting
678,Ferretti2024,INCLUDE,Meets PICOS criteria,Cryptocurrency Turmoil: Unraveling the Collapse of a Unified Stablecoin (USTC) through Twitter as a Passive Sensor,2024,"Ferretti, Stefano and Furini, Marco",Sensors
679,Ronald2024201,INCLUDE,Meets PICOS criteria,STOCK PRICE PREDICTION USING ENSEMBLE LEARNING METHOD ON BIDIRECTIONAL LONG SHORT-TERM MEMORY MODEL WITH ATTENTION MECHANISM AND BERT’S FINANCIAL HEADLINES SENTIMENT,2024,"Ronald, Valensius and Alfrido, Calvin and Isa, S. ...",ICIC Express Letters
680,Moudhich2024690,INCLUDE,Meets PICOS criteria,Graph embedding approach to analyze sentiments on cryptocurrency,2024,"Moudhich, Ihab and Fennan, A.",International Journal of Electrical and Computer Engineering
681,Sakhare202413,INCLUDE,Meets PICOS criteria,Spatial federated learning approach for the sentiment analysis of stock news stored on blockchain,2024,"Sakhare, Nitin Nandkumar and Sagar Imambi, S.",Spatial Information Research
683,Qi2024267,INCLUDE,Meets PICOS criteria,Market Sentiment Analysis Based on Image Processing With Put-Call Volatility Gap Surface,2024,"Qi, Yuanyuan and Guo, Guoxiang and Wang, Yang and ...",IEEE Transactions on Computational Social Systems
684,Cam2024,INCLUDE,Meets PICOS criteria,Sentiment analysis of financial Twitter posts on Twitter with the machine learning classifiers,2024,"Cam, Handan and Cam, Alper Veli and Demirel, Ugur ...",Heliyon
686,Khanapuri2024,INCLUDE,Meets PICOS criteria,Utilizing Fundamental Analysis to Predict Stock Prices,2024,"Khanapuri, Akshay and Darapaneni, Narayana and Pad...",EAI Endorsed Transactions on AI and Robotics
691,Singh2024,INCLUDE,Meets PICOS criteria,Design and Implement Opinion Mining Approach: Using Deep Learning for Large Scale Data,2024,"Singh, Navjot and Bathla, Gaurav",
692,Annalakshmi2024998,INCLUDE,Meets PICOS criteria,Machine Learning Based Stock Price Prediction Using Sentiment Analysis from News Articles,2024,"Annalakshmi, M. S.M. and Vishnu Kumar, M. J. and S...",
693,Agrawal2024,INCLUDE,Meets PICOS criteria,Optimized stacked classifier to predict Hepatitis B disease,2024,"Agrawal, Shweta and Khan, Mohammed Irfan and Pushp...",
694,Yadav2024280,INCLUDE,Meets PICOS criteria,NiftyLLaMA: An open information extraction system integrated with sentiment analysis for Nifty-50 companies using LLaMa-2,2024,"Yadav, Varsha and Kiran Kumar, K.",
695,Anjali2024,INCLUDE,Meets PICOS criteria,A Bidirectional Encoder Representations from Transformers - Multi Head Attention for Predicting the Stock Market Volatility based on Textual Sentiment Analysis,2024,"Anjali, Gurram Siva and Almusawi, Muntather Muhssa...",
696,Gaddam2024189,INCLUDE,Meets PICOS criteria,Sentiment Analysis on Indian Stock Market Using StockTwits Tweets: A Machine Learning Approach,2024,"Gaddam, Ruthvik Reddy and Nelluri, Rutvik and Varm...",Lecture Notes in Networks and Systems
697,Dash2024,INCLUDE,Meets PICOS criteria,Stock Market Trend Prediction Model using Deep Learning based Sentiment Analysis of Financial Data,2024,"Dash, Anupa S. and Mishra, Ujjwal",
698,Chen20244846,INCLUDE,Meets PICOS criteria,Stock Price Prediction Using LLM-Based Sentiment Analysis,2024,"Chen, Qizhao and Kawashima, Hiroaki",
699,Singh2024,INCLUDE,Meets PICOS criteria,Harnessing Sentiment Analysis and Deep Learning for Precise Stock Price Forecasts,2024,"Singh, Sumit Kumar and Kant Sahu, Ravi and Sahoo, ...",
700,Joshi20244896,INCLUDE,Meets PICOS criteria,"A Multi-Modal Transformer Architecture Combining Sentiment Dynamics, Temporal Market Data, and Macroeconomic Indicators for Sturdy Stock Return Forecasting",2024,"Joshi, Abhishek and Koda, Jahnavi Krishna and Hadi...",
702,Nakagawa20246614,INCLUDE,Meets PICOS criteria,Evaluating Company-specific Biases in Financial Sentiment Analysis using Large Language Models,2024,"Nakagawa, Kei and Hirano, Masanori and Fujimoto, Y...",
703,Raut2024,INCLUDE,Meets PICOS criteria,A Review of Social Media Sentiment Analysis Using Machine Learning To Enhance Stock Market Prediction,2024,"Raut, Rohini and Saratkar, Saniya and Thakre, Gaya...",
704,Durga Meena20241169,INCLUDE,Meets PICOS criteria,A Hybrid Model for GAFAM – Stock price Movement Forecasting and Correlation,2024,"Durga Meena, R. and Kalianandi, Maharajan and Sai ...",
706,Shanmugapriya2024733,INCLUDE,Meets PICOS criteria,Stock Sage Navigator: Guiding Investors Through Market Complexities,2024,"Shanmugapriya, S. and Jethin, Gogineni and Priya, ...",
707,Danish2024790,INCLUDE,Meets PICOS criteria,Comparative Sentiment Analysis of Cryptocurrency Apps Using BERT,2024,"Danish, Mohd and Amjad, Mohd and Ahmad, Tanvir",
708,Wu2024410,INCLUDE,Meets PICOS criteria,Integrative Analysis of Financial Market Sentiment Using CNN and GRU for Risk Prediction and Alert Systems,2024,"Wu, You and Sun, Mengfang and Zheng, Hongye and Hu...",
709,Salunke2024,INCLUDE,Meets PICOS criteria,"Optimizing Stock Market Predictions A Comprehensive Framework Utilizing LSTM, Gradient Descent, Auto-Correlation, and Weighted Moving Average",2024,"Salunke, Ujwala and Jadhav, Kiran Bhavlal and Pate...",
711,Singh2024,INCLUDE,Meets PICOS criteria,A Prediction Algorithm for Unlabelled Tweets for Stock Market Data,2024,"Singh, Baljinder and Kaur, Mandeep and Brar, Gurbi...",
712,Singh2024,INCLUDE,Meets PICOS criteria,Enhancing Financial Trading Strategies: A Comprehensive Sentiment Analysis Pipeline,2024,"Singh, Baljinder and Kaur, Mandeep and Brar, Gurbi...",
713,Hirunsri2024445,INCLUDE,Meets PICOS criteria,Sentiment Analysis of ESG Disclosures on Annual Report in Thailand,2024,"Hirunsri, Tharnsaithong and Nadee, Winai",
714,Madhuri20241264,INCLUDE,Meets PICOS criteria,Investor Sentiment based Predictive Stock Market Forecasting using Deep Learning,2024,"Madhuri, Namala and Tamilkodi, R. and Teja, Mallem...",
715,Bhura2024453,INCLUDE,Meets PICOS criteria,Facilitating Stock Recommendations through Sentiment Analysis,2024,"Bhura, Shlok and Bhilare, Tanish and Kelkar, Kavit...",
717,Vinodhini2024959,INCLUDE,Meets PICOS criteria,Multicollinearity Least Square Recursive Optimized Deep Belief Network based Financial News Sentiment Classification for Stock Price Prediction,2024,"Vinodhini, H. and Amuthaguka, D.",
719,Likhitkar202431,INCLUDE,Meets PICOS criteria,Exploring the Intersection of Artificial Intelligence and Financial Decision-Making: A Comprehensive Review,2024,"Likhitkar, Bhavana and Joshi, Arti and Solanki, Sa...",
720,Rathi2024147,INCLUDE,Meets PICOS criteria,Time Series Forecasting for Stock Price Movement: Leveraging NLP for Stock Market Prediction,2024,"Rathi, Chirag and Singh, Dhruv and Bhatnagar, Abhi...",Lecture Notes in Networks and Systems
721,Lin2024297,INCLUDE,Meets PICOS criteria,Artificial Intelligence and Deep Learning in Stock Prediction: A Bibliometric Review,2024,"Lin, Chinyang and Lobo Marques, João Alexandre and...","Proceedings of the European Conference on Management, Leadership and Governance"
722,Vidya2024,INCLUDE,Meets PICOS criteria,A Textual Sentiment Analysis for Stock Price Volatility Forecasting using Bidirectional Long Short-Term Memory,2024,"Vidya, Kamma and Balasubramanian, Prasad and Ramya...",
723,Etcil2024382,INCLUDE,Meets PICOS criteria,Evaluating the Impact of Sentiment Analysis on Deep Reinforcement Learning-Based Trading Strategies,2024,"Etcil, Mustafa and Kolukisa, Burak and Bakir-Güngö...",
724,Jeet2024121,INCLUDE,Meets PICOS criteria,Using Deep Learning Models and FinBERT to Predict the Stock Price of Top Banks in the Dhaka Stock Exchange,2024,"Jeet, Mahir Ayaan Begh and Haque, Rakei Matiul and...",
725,Raju2024,INCLUDE,Meets PICOS criteria,SMT-PREDICT: An Efficient Framework for Stock Market Trend Prediction using Historical and Sentimental Data,2024,"Raju, Abhijith and Arun, K. and Sudha, S. K. and A...",
726,Attaluri2024,INCLUDE,Meets PICOS criteria,News-Driven Stock Price Forecasting in Indian Markets: A Comparative Study of Advanced Deep Learning Models,2024,"Attaluri, Kaushal and Tripathi, Mukesh Kumar and R...",
727,Niranjana2024,INCLUDE,Meets PICOS criteria,Algorithmic Trading Model for Stock Price Forecasting Integrating Forester with Golden Ratio Strategy,2024,"Niranjana, G. and Baskaran, Bharathi and Azizan, A...","IEEE Region 10 Humanitarian Technology Conference, R10-HTC"
728,Ghosh2024,INCLUDE,Meets PICOS criteria,NLP and ML for real-time sentiment analysis in Finance,2024,"Ghosh, Joyita and Maiti, Bidisha and Bhaduri, Apar...",
729,Harit202454,INCLUDE,Meets PICOS criteria,Breaking Down Financial News Impact: A Novel AI Approach with Geometric Hypergraphs,2024,"Harit, Anoushka and Sun, Zhongtian and Yu, Jongmin...",CEUR Workshop Proceedings
732,N’Diaye202421,INCLUDE,Meets PICOS criteria,NLP and Some Research Results in Senegal,2024,"N’Diaye, Samba",Springer Proceedings in Mathematics and Statistics
733,Shareef20241390,INCLUDE,Meets PICOS criteria,RetailGPT: A Fine-Tuned LLM Architecture for Customer Experience and Sales Optimization,2024,"Shareef, Farooq and Ajith, Rishi and Kaushal, Part...",
734,Ravindra20241205,INCLUDE,Meets PICOS criteria,Secure Sentiment Analysis of Stock News Via Blockchain-Integrated Federated Learning,2024,"Ravindra, Thummalapalli and Kumar, V. Sri Niteesh ...",
737,Moodi2024195696,INCLUDE,Meets PICOS criteria,Fusion of Technical Indicators and Sentiment Analysis in a Hybrid Framework of Deep Learning Models for Stock Price Movement Prediction,2024,"Moodi, Fatemeh and Jahangard-Rafsanjani, Amir and ...",IEEE Access
738,Brauneis2024,INCLUDE,Meets PICOS criteria,"Crypto Volatility Forecasting: Mounting a HAR, Sentiment, and Machine Learning Horserace",2024,"Brauneis, Alexander and Sahiner, Mehmet",Asia-Pacific Financial Markets
739,Fu202473,INCLUDE,Meets PICOS criteria,DAM: A Universal Dual Attention Mechanism for Multimodal Timeseries Cryptocurrency Trend Forecasting,2024,"Fu, Yihang and Zhou, Mingyu and Zhang, Luyao",
740,Rai2024,INCLUDE,Meets PICOS criteria,"Fintech and Data Science: Revolutionizing the Financial Services Industry through Risk Analysis, Stock Management, and Automation",2024,"Rai, Manish and Parmar, Hemlata and Jain, Ansh and...",
741,George20241,INCLUDE,Meets PICOS criteria,Improving sentiment analysis of financial news headlines using hybrid Word2Vec-TFIDF feature extraction technique,2024,"George, Meera and Ramasamy, Murugesan",Procedia Computer Science
743,Kong2024162,INCLUDE,Meets PICOS criteria,Large Language Models for Financial and Investment Management: Applications and Benchmarks,2024,"Kong, Yaxuan and Nie, Yuqi and Dong, Xiaowen and M...",Journal of Portfolio Management
744,Upreti20242053,INCLUDE,Meets PICOS criteria,Discrete financial in sentimental analysis using exploring patterns and trends,2024,"Upreti, Kamal and Kapoor, Anmol and Tiwari, Akhile...",Journal of Discrete Mathematical Sciences and Cryptography
745,Haryono2024178672,INCLUDE,Meets PICOS criteria,Permuted Temporal Kolmogorov-Arnold Networks for Stock Price Forecasting Using Generative Aspect-Based Sentiment Analysis,2024,"Haryono, Agus Tri and Sarno, Riyanarto and Anggrai...",IEEE Access
748,Kim202495,INCLUDE,Meets PICOS criteria,Analyzing the Financial Impact of ESG News Sentiment on ESG Finance Trends,2024,"Kim, Minjoong and Kim, Sujin and Kim, Yongsung and...",
749,Rainey2024458,INCLUDE,Meets PICOS criteria,Algorithmic Stock Trading Strategies,2024,"Rainey, Craig and Chen, Min","Proceedings of the International Conference on Multimedia Information Processing and Retrieval, MIPR"
751,Zou2024,INCLUDE,Meets PICOS criteria,Semantic sparse attention-based algorithm for sentiment analysis,2024,"Zou, Jinzhang and Hu, Keyong and Li, Longhao",Proceedings of SPIE - The International Society for Optical Engineering
752,Zhao2024109,INCLUDE,Meets PICOS criteria,Stock Market Prediction Based on Time Series Data and Multimodal Sentiments,2024,"Zhao, Jikang and Deng, Yancong",
753,Bana20241531,INCLUDE,Meets PICOS criteria,Market Price Anticipation using Sentimental Analysis,2024,"Bana, Akanksha and Ahmad, Belal and Rai, Arpit",
754,Kavitha20245070,INCLUDE,Meets PICOS criteria,Real Time Sentiment -Driven Portfolio Optimization: A Machine Learning Approach,2024,"Kavitha, D. and Avala, Sri Karthik and Bohra, Simr...",
755,Mallam2024,INCLUDE,Meets PICOS criteria,Stock Market Price Prediction using Machine Learning,2024,"Mallam, Madhavi and Linga Murthy, M. K. and Devi, ...",
756,Kamath20242485,INCLUDE,Meets PICOS criteria,Event Driven Stock Prediction,2024,"Kamath, Prateek N. and Pradhan, Moksha and Jayanth...",
759,Buche20241784,INCLUDE,Meets PICOS criteria,Exploring Machine Learning Approaches for Analysis and Prediction in the Indian Stock Market,2024,"Buche, Arti and Chandak, Manoj B.",
760,Suresh20241837,INCLUDE,Meets PICOS criteria,Analyzing Market Factors for Stock Price Prediction using Deep Learning Techniques,2024,"Suresh, K. S. and Sarkar, Aritra and Rai, Anjali a...",
761,Reka Onozo2024160529,INCLUDE,Meets PICOS criteria,Leveraging LLMs for Financial News Analysis and Macroeconomic Indicator Nowcasting,2024,"Reka Onozo, Livia and Viktor Arthur, Frigyes and G...",IEEE Access
763,Yildirim2024,INCLUDE,Meets PICOS criteria,NLP in FinTech: Developing a Lightweight Text-to-Chart Application for Financial Analysis,2024,"Yildirim, Simge and Santur, Yunus and Aydogan, Mur...",
764,Choudhary2024131,INCLUDE,Meets PICOS criteria,Stock Price Prediction Leveraging News Headlines,2024,"Choudhary, Mudit and Bajpai, Vikas and Bansal, Anu...",
765,Liashenko2024351,INCLUDE,Meets PICOS criteria,Stock Price Forecasting using Sentiment Analysis of Stock Tweets,2024,"Liashenko, Olena I. and Kravets, Tetyana V. and Pl...","Proceedings - International Conference on Advanced Computer Information Technologies, ACIT"
766,Hitaish2024471,INCLUDE,Meets PICOS criteria,Navigating Financial Markets: Exploring Advanced Neural Networks for Stock Price Prediction,2024,"Hitaish, K. G. and Krishnaswamy, Vani and Vishnu, ...",
767,Billade2024179,INCLUDE,Meets PICOS criteria,Sentiment Analysis for Stock Prediction Using Mass Media Sources,2024,"Billade, Kunal Kishor and Patel, Jeel and Karthik,...",IFIP Advances in Information and Communication Technology
768,Bhardwaj2024,INCLUDE,Meets PICOS criteria,StockGAN: Enhancing Stock Price Prediction with GAN and Sentiment Analysis,2024,"Bhardwaj, Muskaan and Roy, Aditya and Bilgaiyan, S...",
769,Patil2024,INCLUDE,Meets PICOS criteria,Sentiment Analysis of Financial News and its Impact on the Stock Market,2024,"Patil, Aditya and Sharma, Himaanshu and Sinha, Adi...",
770,Di Bari2024,INCLUDE,Meets PICOS criteria,A new methodology to support wind investment decision: a combination of natural language processing and Monte Carlo option pricing technique,2024,"Di Bari, Antonio and Grilli, Luca and Santoro, Dom...",Decisions in Economics and Finance
771,Huang2024796,INCLUDE,Meets PICOS criteria,A FinBERT Framework for Sentiment Analysis of Chinese Financial News,2024,"Huang, Yuesheng and Lin, Renyi and Li, Jiawen and ...",
772,Kondamudi2024448,INCLUDE,Meets PICOS criteria,Real-Time Analysis of Stock Market Prediction Through Social Networks Data,2024,"Kondamudi, Medeswara Rao and Ranjan Sahoo, Somya R...",Lecture Notes in Networks and Systems
774,Amal20241584,INCLUDE,Meets PICOS criteria,Stock Market Prediction using ARIMA and Sentiment Analysis,2024,"Amal, P. S. and Naik, Rajat R. and Rodrigues, Jola...",
775,Kumar202479,INCLUDE,Meets PICOS criteria,Credit Card Fraud Detection,2024,"Kumar, Alok and Poojitha, Marella Venkata and Anuh...",
776,Boncella2024194,INCLUDE,Meets PICOS criteria,AI and management: navigating the alignment problem for ethical and effective decision-making,2024,"Boncella, Robert J.",Issues in Information Systems
779,Li2024,INCLUDE,Meets PICOS criteria,BERT-BiLSTM-Attention model for sentiment analysis on Chinese stock reviews,2024,"Li, Xiaoyan and Chen, Lei and Chen, Baoguo and Ge,...",Applied Mathematics and Nonlinear Sciences
780,Wang20243120,INCLUDE,Meets PICOS criteria,LLMFactor: Extracting Profitable Factors through Prompts for Explainable Stock Movement Prediction,2024,"Wang, Meiyun and Izumi, Kiyoshi and Sakaji, Hiroki",Proceedings of the Annual Meeting of the Association for Computational Linguistics
782,Kirtac20241,INCLUDE,Meets PICOS criteria,Enhanced Financial Sentiment Analysis and Trading Strategy Development Using Large Language Models,2024,"Kirtac, Kemal and Germano, Guido",
783,Varadarajan2024,INCLUDE,Meets PICOS criteria,AI and ML in Finance: Revolutionizing the Future of Banking and Investments,2024,"Varadarajan, Mageshkumar Naarayanasamy and Priya, ...",
784,Jung2024,INCLUDE,Meets PICOS criteria,Decoding Bitcoin: leveraging macro- and micro-factors in time series analysis for price prediction,2024,"Jung, Hae-sun and Kim, Jang Hyun and Lee, Haein",PeerJ Computer Science
785,Mathebula2024144017,INCLUDE,Meets PICOS criteria,ChatGPT as a Text Annotation Tool to Evaluate Sentiment Analysis on South African Financial Institutions,2024,"Mathebula, Miehleketo and Modupe, Abiodun and Mari...",IEEE Access
787,Kaur2024,INCLUDE,Meets PICOS criteria,Strategizing Financial Management in the Age of AI for Enhanced Decision-Making and Predictive Analysis,2024,"Kaur, Mandeep and Luthra, Lavisha and Salgotra, Pr...",
788,Chowdhury2024410,INCLUDE,Meets PICOS criteria,Fired_from_NLP at AraFinNLP 2024: Dual-Phase-BERT - A Fine-Tuned Transformer-Based Model for Multi-Dialect Intent Detection in The Financial Domain for The Arabic Language,2024,"Chowdhury, Md Sajid Alam and Chowdhury, Mostak Mah...",
