id,citation_key,decision,reason,title,year,author,journal
1,Singh2026,INCLUDE,Meets PICOS criteria,SentiVol-GA: a volatility-scaled genetic fusion of predictive models and financial sentiment for adaptive stock forecasting,2026,"Singh, Monika and Tunga, Harinandan and Kar, Samar...",International Journal of Data Science and Analytics
2,Chen2026,INCLUDE,Meets PICOS criteria,A novel sentiment correlation-based method with dual transformer model for stock price prediction,2026,"Chen, Qizhao and Kawashima, Hiroaki",International Journal of Data Science and Analytics
3,Jang2026,INCLUDE,Meets PICOS criteria,Non-English textual analysis with large language models: Analysts’ use of MD&A sentiment in earnings forecasting,2026,"Jang, Jaehee and Wu, Xiaoying",Journal of Contemporary Accounting and Economics
4,Zhu2026,INCLUDE,Meets PICOS criteria,GHOST: Sentiment-gated mamba and stock-wise tokenization attention for enhanced stock prediction,2026,"Zhu, Weijie and Xie, Liang and Fu, Hanyu and Zhang...",Expert Systems with Applications
5,Bouteska2026,INCLUDE,Meets PICOS criteria,Decoding the crypto crowd: how social media sentiment predicts Ethereum’s price,2026,"Bouteska, Ahmed and Harasheh, Murad",Journal of Asset Management
6,Chhalotre2026,INCLUDE,Meets PICOS criteria,AlphaNiftyAI : conquering the Indian stock market with AI,2026,"Chhalotre, Mayur and Chaithra, null and Mohan, Bij...",Digital Finance
7,Gu2026,INCLUDE,Meets PICOS criteria,Enhancing exchange rate forecasting with contextual sentiment indices: A fine-tuned FinBERT approach,2026,"Gu, Guoqin and Song, Yuping",Applied Soft Computing
9,Shi2026,INCLUDE,Meets PICOS criteria,Expert-level financial sentiment analysis via internal and external financial knowledge fusion,2026,"Shi, Lei and Jia, Zhenqi and Liu, Rui",Information Fusion
10,Toksoz2026,INCLUDE,Meets PICOS criteria,Parameter-efficient fine-tuning of LLaMA models for financial sentiment classification,2026,"Toksoz, Seda B.A.Y.A.T. and Isik, Gultekin",Cluster Computing
11,Daş2026,INCLUDE,Meets PICOS criteria,A new hybrid approach combining transformer-based language models and graph neural networks for cryptocurrency forecasting,2026,"Daş, Bihter and Dagdogen, Huseyin Alperen and Kaya...",Engineering Applications of Artificial Intelligence
12,Nejatbakhsh20263926,INCLUDE,Meets PICOS criteria,"Enhancing Stock Market Prediction With Hybrid Deep Learning: Integrating LSTM, Transformer Attention, Federated Learning, and Sentiment Analysis",2026,"Nejatbakhsh, Yousef and Aliasgari, Malihe",IEEE Access
13,Li2026,INCLUDE,Meets PICOS criteria,How do traditional financial markets affect the NFT market? Insights into assets and sentiment impact,2026,"Li, Mingchen and Tian, Yajie and Wang, Jiawei and ...",Computational Economics
14,Wang2026,INCLUDE,Meets PICOS criteria,Bank systemic risk prediction based on text mining and explainable machine learning,2026,"Wang, Pucong and Borjigin, Sumuya Mu Ya",North American Journal of Economics and Finance
15,Huang2026,INCLUDE,Meets PICOS criteria,FinSent-DistillQ: A distilled large language model with chain-of-thought fine-tuning for financial sentiment analysis,2026,"Huang, Yuan and Ma, Tongjia and Yang, Kuohai and Z...",Journal of Intelligent Information Systems
18,Morampudi2026,INCLUDE,Meets PICOS criteria,Analyzing the impact of the sentiment of Covid-19 news on bitcoin through transformer-based models,2026,"Morampudi, Mahesh Kumar and Swain, Chinmaya Kumar ...",Quality and Quantity
19,Tian2026,INCLUDE,Meets PICOS criteria,Reading Between the Reels: An AI-Driven Approach to Analysing Movie Review Sentiment and Market Returns,2026,"Tian, Haowen and Xie, Wenlan Tony and Zhang, Yanle...",International Journal of Finance and Economics
20,Sadashiva Kotekar20262675,INCLUDE,Meets PICOS criteria,Can News Sentiment Improve Deep Learning Models for Nifty 50 Index Forecasting?,2026,"Sadashiva Kotekar, Chaithra and Mohan, Biju R. and...",IEEE Access
21,Song2026,INCLUDE,Meets PICOS criteria,Adapter-Regularised Continual Learning for Dynamic Financial Sentiment Encoding in Multi-Modal Market Fusion,2026,"Song, Zihe and Huang, Renke and Li, Aiqi and Shen,...",Expert Systems
22,Roy202679,INCLUDE,Meets PICOS criteria,A Scalable Real-Time Stock Market Prediction Framework Using LSTM Network and XGBoost Model,2026,"Roy, Amit Kumar and Barbhuyan, Munsifa Firdaus Kha...",Lecture Notes in Networks and Systems
23,Ravula20261034,INCLUDE,Meets PICOS criteria,Interpretable Machine Learning and Sentiment Analysis for Enhanced Predictive Accuracy in Financial Markets,2026,"Ravula, Saideva Sathvik and Sarma, S. V.S.N. and R...",Lecture Notes in Electrical Engineering
24,Koshti2026450,INCLUDE,Meets PICOS criteria,A Comprehensive Study on Stock Market Forecasting Using AI and ML Techniques,2026,"Koshti, Yash and Jain, Rahul and Barhaiya, Himansh...",Lecture Notes in Electrical Engineering
25,Truong2026694,INCLUDE,Meets PICOS criteria,Unified Stock Recommendation System for Vietnamese Stock Market,2026,"Truong, Congdoan and Tran, Ngoc Thanh Binh and van...",Lecture Notes in Networks and Systems
27,Liu20263,INCLUDE,Meets PICOS criteria,Harnessing Quantum Finance and Sentiment for Multi-agent-Driven Financial Prediction,2026,"Liu, Su and Chen, Yueling and Chen, Yuehan and Lee...",Communications in Computer and Information Science
28,Fernando2026287,INCLUDE,Meets PICOS criteria,Analyzing Online User Feedback on Digital Wallets & Buy-Now-Pay-Later Services: Assessing Customer Sentiments of FinTech Solutions in Sri Lanka,2026,"Fernando, Anali and Sudusinghe, Kasundi and Perera...",Communications in Computer and Information Science
31,Ray2026468,INCLUDE,Meets PICOS criteria,Leveraging GPT-4 for Cryptocurrency News Sentiment Detection: A Multi-model Benchmarking,2026,"Ray, Jiban Kumar and Mim, Sheikh Sharfuddin and Lo...",Communications in Computer and Information Science
32,Meesaala2026442,INCLUDE,Meets PICOS criteria,A Comparative Analysis of Financial Risk Management Strategies: Evaluating the Effectiveness of a Novel Approach Against Traditional Models,2026,"Meesaala, Krishna Murthy and Varalakshmi, S. and S...",Lecture Notes in Networks and Systems
34,Thanh2026120,INCLUDE,Meets PICOS criteria,Leveraging Sentiment Analysis for Improved Financial Distress Forecasting in Vietnamese-Listed Firms,2026,"Thanh, Pham Van and Hung, Phan Duy and Truong, Con...",Lecture Notes in Computer Science
35,Wang202628,INCLUDE,Meets PICOS criteria,Stock Price Prediction Based on Investor Sentiment Analysis and CNN-LSTM-Attention Model,2026,"Wang, Maoguang and He, Jiabei",Lecture Notes in Computer Science
37,Wu2026236,INCLUDE,Meets PICOS criteria,CryptoXNet: A Hybrid xLSTM-SE Model with Market Sentiment Integration for Enhanced Cryptocurrency Forecasting and AI-Driven Trading,2026,"Wu, Shuwei and Liang, Peili and He, Jin and Tan, H...",Communications in Computer and Information Science
38,Chao2026311,INCLUDE,Meets PICOS criteria,AI-Based Predictive System for Bull-Side Put Spread Trading Strategy Using Decision Tree Algorithm,2026,"Chao, Chifang and Hsieh, Minghua and Chen, Minkuan...","Smart Innovation, Systems and Technologies"
39,Krishnan2026269,INCLUDE,Meets PICOS criteria,Enhancing Market Efficiency in High-Frequency Trading Using Advanced Machine Learning Models for Profitability,2026,"Krishnan, Deepika and Maurya, Ankur and Pandey, Pr...",Lecture Notes in Networks and Systems
40,Yang202624,INCLUDE,Meets PICOS criteria,FinPTA: An Effective Model for Financial Sentiment Analysis,2026,"Yang, Chen and Yi, Xiao and Fan, Guisheng and Yu, ...",Lecture Notes in Computer Science
41,Niño Peña2026177,INCLUDE,Meets PICOS criteria,"Comparison of Statistical, Machine Learning, and AI-Based Models for Bitcoin (BTC) Price Prediction: A Multi-algorithmic Evaluation",2026,"Niño Peña, Christiam Alejandro and Herrera-Cuartas...",Communications in Computer and Information Science
45,Waghmare2026205,INCLUDE,Meets PICOS criteria,Utilization of BiLSTM-RNN to identify tweets for forecasting stock market volatility,2026,"Waghmare, Ganesh and Mishra, Jyoti and Gondane, Vi...",International Journal of Information Technology (Singapore)
46,Chathli202655,INCLUDE,Meets PICOS criteria,LSTM-GRU: Stocks Prediction Using Hybrid Machine Learning Algorithms,2026,"Chathli, Raghav and Sachin, null and Shambharkar, ...",Lecture Notes in Networks and Systems
47,Farrugia20261,INCLUDE,Meets PICOS criteria,Mapping Market Mood: A Data-Driven Analysis of Sentiment and Cryptocurrency Price Dynamics,2026,"Farrugia, Franco and Deguara, Cedric",Lecture Notes in Computer Science
48,Bleeker2026353,INCLUDE,Meets PICOS criteria,Forecasting Stock Market Reactions Using Decomposed Topics and Sentiments in Earning Calls,2026,"Bleeker, Malte and Tha, Huynh",Journal of Forecasting
49,Brown202699,INCLUDE,Meets PICOS criteria,ABusing Social Media and Sentiment Analysis for Stock Market Prediction,2026,"Brown, Crawford and Pitropakis, Nikolaos and Chrys...",Lecture Notes in Computer Science
50,Al-Sharafi2026,INCLUDE,Meets PICOS criteria,"A longitudinal consumer feedback analytics approach for theory building and testing: Examining consumer satisfaction and loyalty in buy now, pay later (BNPL) platforms",2026,"Al-Sharafi, Mohammed A. and Alzaeemi, S. Abdulhabi...",Journal of Retailing and Consumer Services
51,Lin2025181,INCLUDE,Meets PICOS criteria,Financial Market Sentiment Prediction Based on BERT-Based Sentiment Analysis Model,2025,"Lin, Yanqing",
52,Han2025497,INCLUDE,Meets PICOS criteria,Multi-source Text Mining for Risk Signal Detection in Asset-Backed Securities Market: An NLP-driven Data Analytics Approach,2025,"Han, Jiahui",
53,Ding2025678,INCLUDE,Meets PICOS criteria,Efficient Financial Sentiment Analysis via LLM Fine-Tuning with Preference Optimization,2025,"Ding, Yixuan and Sun, Jianxia",
56,Huang2025328,INCLUDE,Meets PICOS criteria,Deep Learning-Enhanced Dynamic Margin Period of Risk Prediction for Counterparty Credit Risk Management: A Multi-Modal Approach Integrating Market Sentiment Analysis and Real-Time Exposure Assessment,2025,"Huang, Yutong",
57,Zheng2025530,INCLUDE,Meets PICOS criteria,Research on S&P 500 Index Forecast and Trading Strategy Based on Advanced Language Model Financial Sentiment Analysis and Machine Learning,2025,"Zheng, Chakfong",
59,Song2025,INCLUDE,Meets PICOS criteria,From Market Volatility to Predictive Insight: An Adaptive Transformer–RL Framework for Sentiment-Driven Financial Time-Series Forecasting,2025,"Song, Zhicong and Tsang, Harris Sik Ho and Hsung, ...",Forecasting
60,Kim-Hahm2025,INCLUDE,Meets PICOS criteria,News vs. Social Media: Sentiment Impact on Stock Performance of Big Tech Companies,2025,"Kim-Hahm, Hyunsun and Abou-Zaid, Ahmed Sabry and M...",Journal of Risk and Financial Management
61,Bouzari2025,INCLUDE,Meets PICOS criteria,Intelligent Sustainability: Evaluating Transformers for Cryptocurrency Environmental Claims,2025,"Bouzari, Parisa and Fekete-Farkas, Maria and Szala...",Information (Switzerland)
62,Alalmai2025266,INCLUDE,Meets PICOS criteria,"Prediction of TASI returns using sentiment analysis and hybrid modeling methods: ARIMAX, random forest, and XGBoost",2025,"Alalmai, Somaiyah",International Journal of Advanced and Applied Sciences
63,Cristescu2025,INCLUDE,Meets PICOS criteria,Fine-Tuning and Explaining FinBERT for Sector-Specific Financial News: A Reproducible Workflow,2025,"Cristescu, Marian Pompiliu and Brândaş, Claudiu an...",Electronics (Switzerland)
65,Prastowo20255231,INCLUDE,Meets PICOS criteria,Exploring the influence of soft information from economic news on exchange rate and gold price movements,2025,"Prastowo, Rahardito Dio and Budi, Indra Y. and Ram...",IAES International Journal of Artificial Intelligence
66,Yu2025,INCLUDE,Meets PICOS criteria,Exploring the role of social bots in cryptocurrency manipulation: Machine learning insights from the LUNA crash,2025,"Yu, Yanzhen and Zhou, Rui and Jiang, Rongchuan and...",Electronic Markets
68,Safari2025,INCLUDE,Meets PICOS criteria,A novel framework using particle swarm optimization and long short-term memory networks for stock market forcasting,2025,"Safari, Mohammad Esmael Heidari and Hosseini, Sood...",Scientific Reports
69,Shcherbak2025353,INCLUDE,Meets PICOS criteria,Business Analytics and Digitalization as Drivers of Startup Evaluation: The Experience of the Baltic States,2025,"Shcherbak, Valeriia G. and Dorokhov, Oleksandr V. ...",Organizacija
70,Huang2025,INCLUDE,Meets PICOS criteria,"Dumb money? Social network attention herding, sentiment, and markets",2025,"Huang, Chengcheng Charlie and Shum Nolan, Pauline",Journal of Finance and Data Science
71,Chen2025,INCLUDE,Meets PICOS criteria,Integrating Taiwan financial BERT sentiment analysis with CNN-BiLSTM-SA model for stock prediction,2025,"Chen, Guanwei and Hsu, I. Ching",Discover Computing
73,Singh20255497,INCLUDE,Meets PICOS criteria,SABER: a multimodal sentiment aware regression framework using ROBERTa BiLSTM and deep batch active learning for stock market prediction,2025,"Singh, Chetanpal and Warraich, Jatinder and Thakka...",International Journal of Information Technology (Singapore)
74,Yu20254418,INCLUDE,Meets PICOS criteria,CausalSeqGNN: A Fama-French Inspired Fuzzy Cognitive Map Combined With Graph Neural Network for Stock Prediction,2025,"Yu, He and Liu, Jing",IEEE Transactions on Fuzzy Systems
75,Denekew2025,INCLUDE,Meets PICOS criteria,Integrating Large Language Models and CNN-LSTM for Enhanced Portfolio Optimization,2025,"Denekew, Arega and Berehane, Tesfahun and Adam, Mo...",Operations Research Forum
76,Nakatsuka2025605,INCLUDE,Meets PICOS criteria,Extracting information and sentiment analysis on dialogue in financial results briefing,2025,"Nakatsuka, Hiromasa and Suimon, Yoshiyuki",Digital Finance
77,Tiwari2025,INCLUDE,Meets PICOS criteria,Attention-augmented hybrid CNN-LSTM model for social media sentiment analysis in cryptocurrency investment decision-making,2025,"Tiwari, Dimple and Bhati, Bhoopesh Singh and Nagpa...",Scientific Reports
78,Yang2025,INCLUDE,Meets PICOS criteria,The power of ChatGPT in processing text: Evidence from analysis and prediction in the exchange rate markets,2025,"Yang, Kun and Deng, Ruxin and Wei, Yunjie and Wang...",Financial Innovation
79,Varela2025,INCLUDE,Meets PICOS criteria,An analytical framework for real-time gold trading using sentiment and time-series forecasting,2025,"Varela, Angel and Siam, Md Kamrul Hossain and Maru...",Decision Analytics Journal
80,Shrivastava2025,INCLUDE,Meets PICOS criteria,Benchmarking modeling architectures for cryptocurrency price prediction using financial and social media data,2025,"Shrivastava, Tulika and Suleiman, Basem and Desa, ...",Social Network Analysis and Mining
81,Altybayeva2025,INCLUDE,Meets PICOS criteria,ICAIMT — AI Assistant for Wealth Management «ECO InvestMind AI»,2025,"Altybayeva, Nuriman and Sapar, Oralbek and Akzhalo...",Journal of Information and Knowledge Management
84,Wang20251955,INCLUDE,Meets PICOS criteria,From news to trends: a financial time series forecasting framework with LLM-driven news sentiment analysis and selective state spaces,2025,"Wang, Renjie and Sun, Minghui and Wang, Limin",Journal of Intelligent Information Systems
85,Khan2025679,INCLUDE,Meets PICOS criteria,Bridging finance and AI: a comprehensive survey of large language models in financial system,2025,"Khan, Ameer Tamoor and Li, Shuai and Cao, Xinwei",Digital Finance
86,Haase2025,INCLUDE,Meets PICOS criteria,Wisdom of the crowd signals: Predictive power of social media trading signals for cryptocurrencies,2025,"Haase, Frederic and Celig, Tom and Rath, Oliver an...",Electronic Markets
88,Yao2025,INCLUDE,Meets PICOS criteria,The colour of finance words in Chinese,2025,"Yao, Kai and Zheng, Zexu and Liu, Cai",Pacific Basin Finance Journal
89,Liu2025,INCLUDE,Meets PICOS criteria,A sentiment-driven three-stage approach for multi-scale carbon price prediction,2025,"Liu, Yongliang and Tang, Chunling and Zhou, Aiying...",Discover Sustainability
90,Seabe2025,INCLUDE,Meets PICOS criteria,"Sentiment-driven cryptocurrency forecasting: analyzing LSTM, GRU, Bi-LSTM, and temporal attention model (TAM)",2025,"Seabe, Phumudzo Lloyd and Bambe Moutsinga, Claude ...",Social Network Analysis and Mining
91,Chen2025,INCLUDE,Meets PICOS criteria,Leveraging large language model as news sentiment predictor in stock markets: a knowledge-enhanced strategy,2025,"Chen, Weisi and Liu, Wulong and Zheng, Jiaxin and ...",Discover Computing
92,Xie20253820,INCLUDE,Meets PICOS criteria,Carbon emission pricing prediction based on autoregressive history and external signals: a multi-frequency deep time series network based on MF-VAR-LSTM,2025,"Xie, Hanlong and Zou, Tianhuiyu and Fu, Fangli and...",KSII Transactions on Internet and Information Systems
93,Wu202525,INCLUDE,Meets PICOS criteria,Stock Price Prediction Method Based on Optimized LSTM and Quantified News Sentiment,2025,"Wu, Chengshang and Song, Zhiheng and Nie, Zhiqi an...",
98,Tan2025960,INCLUDE,Meets PICOS criteria,"Vision, Voice, and Text: Pioneering Zero-shot Multimodal LLMs for Sentiment-driven Investment",2025,"Tan, Su and So, Chichiu and Sun, Yueyue and Wang, ...",
100,Pitta de Jesus20253735,INCLUDE,Meets PICOS criteria,"Forecasting Brazilian Stock Market Using Sentiment Indices from Textual Data, Chat-GPT-Based and Technical Indicators",2025,"Pitta de Jesus, Diego and de Medeiros, Elvira Hele...",Computational Economics
101,Tan2025,INCLUDE,Meets PICOS criteria,Financial text analysis and credit risk assessment using a GPT-4 and improved BERT fusion model,2025,"Tan, Huirong and Xie, Yanruixue",PLOS ONE
102,Dai2025296,INCLUDE,Meets PICOS criteria,Deep Learning-based anomaly detection in stock markets and business decision support,2025,"Dai, Changjiang",Future Technology
105,Zhou2025,INCLUDE,Meets PICOS criteria,Sentiment analysis of cancer screening in Chinese social media: Qualitative studies based on machine learning,2025,"Zhou, Qi and Qian, Lingling and Wu, Luyu and Wu, H...",PLOS ONE
107,Felix20251263,INCLUDE,Meets PICOS criteria,FINMIXER: ENHANCING STOCK PRICE PREDICTION ACCURACY THROUGH FINANCIAL SENTIMENT ANALYSIS AND DEEP LEARNING WITH COVARIATE FORECASTING,2025,"Felix, null and Santoso Gunawan, Alexander Agung",ICIC Express Letters
108,Chou2025,INCLUDE,Meets PICOS criteria,AI-fused construction portfolio investment system with risk hedging using machine learning and long-short strategies,2025,"Chou, Juisheng and Lin, Kai Chun and Pham, Tran Ba...",Applied Soft Computing
109,Ibrahim20251152,INCLUDE,Meets PICOS criteria,From headlines to stock trends: Natural language processing and explainable artificial intelligence approach to predicting Türkiye's financial pulse,2025,"Ibrahim, Mahat Maalim and Islam Khan, Asad Ul and ...",Borsa Istanbul Review
110,Ameen Bakather20251410,INCLUDE,Meets PICOS criteria,Time-frequency dynamics of public sentiment transmission in GCC equity markets: evidence from textual analysis,2025,"Ameen Bakather, Adnan and Chowdhury, Mohammad Ashr...",International Journal of Islamic and Middle Eastern Finance and Management
112,Zhu20256289,INCLUDE,Meets PICOS criteria,Towards Temporal-Aware Multi-Modal Retrieval Augemented Generation in Finance,2025,"Zhu, Fengbin and Li, Junfeng and Pan, Liangming an...",
113,Fang202592,INCLUDE,Meets PICOS criteria,Sentiment-Driven Nonlinear Relationship between Financial Market Emotion and Returns: Dynamic Adaptive Modeling Based on LLMs,2025,"Fang, Junyi and Liu, Xiaojian and Zhou, Minshuai",
114,Mo20253033,INCLUDE,Meets PICOS criteria,MoF: A Background-Aware Multi-source Fusion Financial Trend Forecasting Mechanism,2025,"Mo, Fengting and Yan, Shanshan and Xiao, Yinhao",Computational Economics
116,Priyadarshi2025817,INCLUDE,Meets PICOS criteria,Sentiment-driven deep learning framework for insider trading detection in Indian stock market,2025,"Priyadarshi, Prashant and Kumar, Prabhat",Journal of Economic Interaction and Coordination
117,Li2025,INCLUDE,Meets PICOS criteria,Integrating Multi-Source Data to Model Consumer Confidence: A 3D-SDIM Application in Urban Contexts,2025,"Li, Tao and Miao, Li’e",SAGE Open
118,Liu2025,INCLUDE,Meets PICOS criteria,LLM-Driven Sentiment Analysis in MD&A: A Multi-Agent Framework for Corporate Misconduct Prediction,2025,"Liu, Yeling and Liu, Yongkang and Yang, Kai",Systems
119,Chuang2025,INCLUDE,Meets PICOS criteria,Chinese Financial News Analysis for Sentiment and Stock Prediction: A Comparative Framework with Language Models,2025,"Chuang, Hsiumin and He, Hsiangchih and Hu, Mingche",Big Data and Cognitive Computing
121,Bourday20251,INCLUDE,Meets PICOS criteria,A Transfer Learning–Enhanced Hybrid Deep Learning Framework for Bitcoin Price Forecasting Using Market Sentiment and Time Series Data,2025,"Bourday, Rachid and Aattouchi, Issam and Ait Kerro...",International Journal of Information Engineering and Electronic Business
124,Jung2025,INCLUDE,Meets PICOS criteria,Detecting Bitcoin Sentiment: Leveraging Language Model Applications in Sentiment Analysis for Bitcoin Price Prediction,2025,"Jung, Hae-sun and Lee, Haein and Kim, Jang Hyun",Neural Processing Letters
126,Cao2025,INCLUDE,Meets PICOS criteria,Value-at-risk forecasting- based on textual information and a hybrid deep learning-based approach,2025,"Cao, Yangfan and Choo, W. C. and Matemilola, Bolaj...",International Review of Economics and Finance
127,Zhang2025,INCLUDE,Meets PICOS criteria,GNN-based social media sentiment analysis for stock market forecasting and trading,2025,"Zhang, Pengju and Harris, Richard D.F. and Zheng, ...",Expert Systems with Applications
128,İnce20255315,INCLUDE,Meets PICOS criteria,A new YOLO-based financial trading optimization model: YOLOFin—a case study in the cryptocurrency market,2025,"İnce, Muhammet Rıdvan and Kurt Pehlivanoğlu, Melte...",AI and Society
129,Gurgul20251666,INCLUDE,Meets PICOS criteria,"Deep learning and NLP in cryptocurrency forecasting: Integrating financial, blockchain, and social media data",2025,"Gurgul, Vincent and Lessmann, Stefan and Härdle, W...",International Journal of Forecasting
131,Nie2025328,INCLUDE,Meets PICOS criteria,The Application of Artificial Intelligence in Financial Prediction,2025,"Nie, Rongxiu and Liu, Ziyi and Yu, Wenyue and Zhan...",Frontiers in Artificial Intelligence and Applications
132,Huang2025214,INCLUDE,Meets PICOS criteria,NLP-Enhanced Detection of Wrong-Way Risk Contagion Patterns in Interbank Networks: A Deep Learning Approach,2025,"Huang, Yutong",
133,Khalife20251365,INCLUDE,Meets PICOS criteria,Analyzing the impact of investor sentiment on S&P 500 prices using deep learning models,2025,"Khalife, Danielle and Yammine, Jad and El Bazi, Ta...",Journal of Financial Reporting and Accounting
135,Trushkovskyi2025535,INCLUDE,Meets PICOS criteria,Application of Social Media Sentiment Analysis for Developing Trading Models in the Cryptocurrency Market,2025,"Trushkovskyi, Andrii",Journal of Applied Economic Sciences
137,Ooi2025297,INCLUDE,Meets PICOS criteria,Machine Learning vs. Human Investors: Analyzing Adaptive Herding Behavior in U.S. Stocks vs. Shariah-Compliant Stocks in Malaysia and Indonesia,2025,"Ooi, Kok Loang and Candra, Sevenpri",Gadjah Mada International Journal of Business
139,Sultana2025,INCLUDE,Meets PICOS criteria,"Advancing Firm-Specific ESG Sentiment Analysis: A Machine Learning Approach to Clustering, Prediction, and Financial Performance Implications",2025,"Sultana, Nargis and Zeya, Fahad",Business Strategy and Development
140,Gaur20253198,INCLUDE,Meets PICOS criteria,Sentiment-driven forecasting: enhancing cryptocurrency price prediction with biLSTM and DistilBERT,2025,"Gaur, Shyama and Singh, Harshit and Chaudhary, Rij...",International Journal of System Assurance Engineering and Management
142,Todd2025,INCLUDE,Meets PICOS criteria,A multimodal sentiment classifier for financial decision making,2025,"Todd, Andrew and Bowden, James and Cummins, Mark a...",International Review of Financial Analysis
143,Weber2025690,INCLUDE,Meets PICOS criteria,Implicit coordination in sellers’ inflation: How cost shocks facilitate price hikes,2025,"Weber, Isabella Maria and Wasner, Evan and Lang, M...",Structural Change and Economic Dynamics
144,Wang20251969,INCLUDE,Meets PICOS criteria,A Novel Framework for Agricultural Futures Price Prediction With BERT-Based Topic Identification and Sentiment Analysis,2025,"Wang, Wensheng and Liu, Yuxi",Journal of Forecasting
145,Tang20253352,INCLUDE,Meets PICOS criteria,Decision-Making in M&A Under Market Mispricing: The Role of Deep Learning Models,2025,"Tang, Yuxuan",Managerial and Decision Economics
146,Tripathi20252199,INCLUDE,Meets PICOS criteria,Deep Learning Sentiment Analysis of News and Social Media in Geopolitical Crises,2025,"Tripathi, Neelam and Rao, D. Srinivasa",Ingenierie des Systemes d'Information
147,Jain2025,INCLUDE,Meets PICOS criteria,Multi-model ensemble deep learning framework for robust stock market forecasting: Integration of economic indicators and temporal dependencies,2025,"Jain, Prasham and Bishnoi, Dwij and Bishnoi, Neel ...",Proceedings of SPIE - The International Society for Optical Engineering
149,Liu2025,INCLUDE,Meets PICOS criteria,A multimodal deep learning framework for constructing a market sentiment index from stock news,2025,"Liu, Yunting and Huang, Yirong",Big Data Research
150,Yang202591,INCLUDE,Meets PICOS criteria,Research on stock market sentiment analysis and prediction method based on convolutional neural network,2025,"Yang, Wei and Lin, Yuzhen and Xue, Haozhong and Wa...",
151,Sui2025121,INCLUDE,Meets PICOS criteria,Research on SSE 50 Index Prediction Based on Wavelet Denoising and BP Neural Network with Textual Information Integration,2025,"Sui, Xin and Zhang, Qi and Xu, Haoran",
